origin_path	path	family	audience	claim_clusters	evidence_sources	status	disposition	notes
docs/superpowers/plans/archive/2026-05-25-adoption-safety-and-integrity.md	docs/superpowers/plans/archive/2026-05-25-adoption-safety-and-integrity.md	historical	historical	adoption; command-risk; CAS; preview-hardening; implementation-plan	docs/superpowers/specs/archive/2026-05-25-preview-invariant-hardening-design.md; apps/conary/src/dispatch.rs; apps/conary/src/commands/adopt; apps/conary/src/commands/changeset_metadata.rs; crates/conary-core/src/filesystem/cas.rs; apps/conary/tests/live_host_mutation_safety.rs	verified	archived	Archived from docs/superpowers/plans/2026-05-25-adoption-safety-and-integrity.md after the preview invariant hardening milestone completed: Plan A adoption safety and integrity, Plan B generation publication durability, and Plan C docs/CI truth checks all landed with CI-backed verification.
docs/superpowers/plans/archive/2026-05-26-docs-ci-truth-checks.md	docs/superpowers/plans/archive/2026-05-26-docs-ci-truth-checks.md	historical	historical	docs-truth; ci; conaryd; schema; policykit; command-drift; preview-hardening	docs/superpowers/specs/archive/2026-05-26-docs-ci-truth-checks-design.md; scripts/check-doc-audit-ledger.sh; scripts/docs-audit-inventory.sh; .github/workflows/pr-gate.yml; apps/conaryd/src/daemon/routes; apps/conaryd/src/daemon/auth.rs; apps/conaryd/src/daemon/mod.rs; crates/conary-core/Cargo.toml	verified	archived	Archived from docs/superpowers/plans/2026-05-26-docs-ci-truth-checks.md after the preview invariant hardening milestone completed: Plan A adoption safety and integrity, Plan B generation publication durability, and Plan C docs/CI truth checks all landed with CI-backed verification.
docs/superpowers/plans/archive/2026-05-26-generation-publication-durability.md	docs/superpowers/plans/archive/2026-05-26-generation-publication-durability.md	historical	historical	generation-publication; recovery; crash-consistency; durable-fsync; implementation-plan	docs/superpowers/specs/archive/2026-05-26-generation-publication-durability-design.md; crates/conary-core/src/db/models; crates/conary-core/src/generation/mount.rs; crates/conary-core/src/transaction/recovery.rs; apps/conary/src/commands/composefs_ops.rs; apps/conary/src/commands/generation/commands.rs; apps/conary/src/commands/install/mod.rs; apps/conary/src/commands/install/batch.rs; apps/conary/src/commands/remove.rs	verified	archived	Archived from docs/superpowers/plans/2026-05-26-generation-publication-durability.md after the preview invariant hardening milestone completed: Plan A adoption safety and integrity, Plan B generation publication durability, and Plan C docs/CI truth checks all landed with CI-backed verification.
docs/superpowers/plans/archive/2026-05-22-llm-native-operations-surface.md	docs/superpowers/plans/archive/2026-05-22-llm-native-operations-surface.md	historical	historical	llm-native-operations; mcp-adapter; historical-framing	docs/operations/agent-mcp-adapter-decision.md; crates/conary-mcp/src/stateless.rs; crates/conary-mcp/src/stateless_http.rs; apps/conary-test/src/bootstrap.rs	verified	archived	Archived completed LLM-native operations surface plan from the active planning lane after milestone implementation and follow-on stateless/resource slices landed.
docs/superpowers/plans/archive/2026-05-22-local-bootstrap-smoke-proof-loop.md	docs/superpowers/plans/archive/2026-05-22-local-bootstrap-smoke-proof-loop.md	historical	historical	llm-native-operations; bootstrap-smoke; historical-framing	docs/operations/agent-mcp-adapter-decision.md; crates/conary-mcp/src/stateless.rs; crates/conary-mcp/src/stateless_http.rs; apps/conary-test/src/bootstrap.rs	verified	archived	Archived completed local bootstrap smoke proof-loop plan from the active planning lane after implementation and docs landed.
docs/superpowers/plans/archive/2026-05-22-stateless-mcp-adapter-compliance.md	docs/superpowers/plans/archive/2026-05-22-stateless-mcp-adapter-compliance.md	historical	historical	llm-native-operations; mcp-adapter; historical-framing	docs/operations/agent-mcp-adapter-decision.md; crates/conary-mcp/src/stateless.rs; crates/conary-mcp/src/stateless_http.rs; apps/conary-test/src/bootstrap.rs	verified	archived	Archived completed stateless MCP adapter compliance plan from the active planning lane after the harness and decision-record updates landed.
docs/superpowers/plans/archive/2026-05-24-conary-test-bootstrap-status-resource.md	docs/superpowers/plans/archive/2026-05-24-conary-test-bootstrap-status-resource.md	historical	historical	mcp; bootstrap-status; historical-framing	docs/superpowers/specs/archive/2026-05-24-conary-test-bootstrap-status-resource-design.md; crates/conary-mcp/src/stateless.rs; crates/conary-mcp/src/stateless_http.rs; apps/conary-test/src/server/stateless_mcp.rs	verified	archived	Archived completed conary-test bootstrap-status stateless resource plan from the active planning lane after implementation and docs landed.
docs/superpowers/plans/archive/2026-05-24-conary-test-stateless-discover-route.md	docs/superpowers/plans/archive/2026-05-24-conary-test-stateless-discover-route.md	historical	historical	mcp; conary-test; stateless-discovery; historical-framing	docs/superpowers/specs/archive/2026-05-24-conary-test-stateless-discover-route-design.md; apps/conary-test/src/server/routes.rs; crates/conary-mcp/src/stateless_http.rs	verified	archived	Archived completed conary-test stateless discovery route plan from the active planning lane after implementation and follow-on resources landed.
docs/superpowers/plans/archive/2026-05-24-conary-test-suites-resource.md	docs/superpowers/plans/archive/2026-05-24-conary-test-suites-resource.md	historical	historical	mcp; conary-test-suites; historical-framing	docs/superpowers/specs/archive/2026-05-24-conary-test-suites-resource-design.md; apps/conary-test/src/server/stateless_mcp.rs; apps/conary-test/src/bootstrap.rs; apps/conary-test/src/config/manifest.rs	verified	archived	Archived completed conary-test suites stateless resource plan from the active planning lane after final acceptance passed.
docs/superpowers/plans/archive/2026-05-24-stateless-raw-http-adapter-proof.md	docs/superpowers/plans/archive/2026-05-24-stateless-raw-http-adapter-proof.md	historical	historical	llm-native-operations; mcp-adapter; raw-http-proof; historical-framing	docs/operations/agent-mcp-adapter-decision.md; crates/conary-mcp/src/stateless.rs; crates/conary-mcp/src/stateless_http.rs; apps/conary-test/src/bootstrap.rs	verified	archived	Archived completed stateless raw HTTP adapter proof plan from the active planning lane after the proof and live conary-test route slices landed.
docs/superpowers/plans/archive/2026-04-10-all-tracks-release-hardening-plan.md	docs/superpowers/plans/archive/2026-04-10-all-tracks-release-hardening-plan.md	historical	historical	release-plan; historical-framing	docs/superpowers/archive/2026-04-10-release-hardening-checklist.md; docs/operations/infrastructure.md; scripts/release.sh	verified	archived	Archived from docs/superpowers/plans/2026-04-10-all-tracks-release-hardening-plan.md after release-hardening work moved into historical reference.
docs/superpowers/plans/archive/2026-04-16-conaryd-forge-staging-deployment-plan.md	docs/superpowers/plans/archive/2026-04-16-conaryd-forge-staging-deployment-plan.md	historical	historical	conaryd-deploy-plan; historical-framing	deploy/FORGE.md; docs/operations/infrastructure.md; scripts/conaryd-health.sh	verified	archived	Archived from docs/superpowers/plans/2026-04-16-conaryd-forge-staging-deployment-plan.md; current conaryd readiness docs live in README and architecture docs.
docs/superpowers/plans/archive/2026-04-22-generation-artifact-export-unification-plan.md	docs/superpowers/plans/archive/2026-04-22-generation-artifact-export-unification-plan.md	historical	historical	generation-export-plan; historical-framing	docs/operations/post-generation-export-follow-up-roadmap.md; docs/INTEGRATION-TESTING.md; crates/conary-core/src/generation/export.rs	verified	archived	Archived from docs/superpowers/plans/2026-04-22-generation-artifact-export-unification-plan.md; ISO remained a follow-up, and OCI source loading has since moved onto the generation artifact contract.
docs/superpowers/plans/archive/2026-04-30-installed-runtime-generations-self-contained-plan.md	docs/superpowers/plans/archive/2026-04-30-installed-runtime-generations-self-contained-plan.md	historical	historical	installed-runtime-plan; historical-framing	docs/operations/post-generation-export-follow-up-roadmap.md; docs/INTEGRATION-TESTING.md; crates/conary-core/src/generation/builder/runtime_inputs.rs	verified	archived	Archived from docs/superpowers/plans/2026-04-30-installed-runtime-generations-self-contained-plan.md after installed-runtime export moved into validated current docs.
docs/superpowers/plans/archive/2026-05-02-audit-hardening-plan.md	docs/superpowers/plans/archive/2026-05-02-audit-hardening-plan.md	historical	historical	audit-hardening; historical-framing	README.md; ROADMAP.md; apps/conaryd/src/daemon/routes/transactions.rs; docs/superpowers/plans/archive/2026-05-06-limited-public-release-readiness-plan.md	verified	archived	Archived after blocklist, mount fallback, conaryd route honesty, distro catalog, and security-audit items were either completed or carried forward explicitly.
docs/superpowers/plans/archive/2026-05-02-redesign-followups-plan.md	docs/superpowers/plans/archive/2026-05-02-redesign-followups-plan.md	historical	historical	redesign-followups; historical-framing	README.md; ROADMAP.md; docs/superpowers/plans/archive/2026-05-06-limited-public-release-readiness-plan.md	verified	archived	Archived after release-scoped follow-ups were separated from deferred redesign work such as unwrap cleanup and conaryd package executor design.
docs/superpowers/plans/archive/2026-05-06-limited-public-release-readiness-plan.md	docs/superpowers/plans/archive/2026-05-06-limited-public-release-readiness-plan.md	historical	historical	release-readiness; validation; public-preview	README.md; ROADMAP.md; docs/superpowers/limited-preview-release-checkpoint-2026-05-16.md; docs/superpowers/limited-preview-subreddit-tester-post-2026-05-19.md; scripts/release-cargo-audit.sh	verified	archived	Archived from the top-level plans directory after the current limited-preview decision moved to the checkpoint and tester-post docs; retained as the historical release-gate plan.
docs/superpowers/plans/archive/2026-05-12-composefs-atomic-modernization-plan.md	docs/superpowers/plans/archive/2026-05-12-composefs-atomic-modernization-plan.md	historical	historical	composefs-modernization; generation-contract; historical-framing	docs/superpowers/specs/archive/2026-05-12-composefs-atomic-modernization-design.md; docs/INTEGRATION-TESTING.md; docs/operations/post-generation-export-follow-up-roadmap.md; crates/conary-core/src/transaction/mod.rs	verified	archived	Archived after composefs atomic switching implementation, validation, merge, and push to main; active docs now record next-boot selection and Group N evidence.
docs/superpowers/plans/archive/2026-05-14-adopt-without-regret-plan.md	docs/superpowers/plans/archive/2026-05-14-adopt-without-regret-plan.md	historical	historical	adoption; unadopt; implementation-plan; public-preview	README.md; ROADMAP.md; docs/INTEGRATION-TESTING.md; apps/conary/tests/integration/remi/manifests/phase1-advanced.toml	verified	archived	Archived from the top-level plans directory after the Adopt Without Regret implementation and three-distro unadoption proof landed; active docs carry the current adoption boundary.
docs/superpowers/plans/archive/2026-05-14-limited-preview-honesty-first-pass-plan.md	docs/superpowers/plans/archive/2026-05-14-limited-preview-honesty-first-pass-plan.md	historical	historical	codebase-honesty; implementation-plan; public-preview	README.md; ROADMAP.md; docs/ARCHITECTURE.md; apps/conaryd/src/daemon/routes/transactions.rs	verified	archived	Archived from the top-level plans directory after the first honesty pass landed; current preview caveats live in README, ROADMAP, integration docs, and the limited-preview checkpoint.
docs/superpowers/plans/archive/2026-05-14-native-package-manager-parity-slice-a-plan.md	docs/superpowers/plans/archive/2026-05-14-native-package-manager-parity-slice-a-plan.md	historical	historical	native-package-manager-parity; implementation-plan; install-remove; public-preview	docs/INTEGRATION-TESTING.md; apps/conary/tests/native_pm_live_root.rs; apps/conary/src/commands/install/mod.rs; apps/conary/src/commands/remove.rs	verified	archived	Archived from the top-level plans directory after Slice A no-generation install/remove behavior landed and later slices built on it.
docs/superpowers/plans/archive/2026-05-15-native-package-manager-parity-slice-b-plan.md	docs/superpowers/plans/archive/2026-05-15-native-package-manager-parity-slice-b-plan.md	historical	historical	native-package-manager-parity; implementation-plan; update; security-updates; public-preview	docs/INTEGRATION-TESTING.md; apps/conary/tests/native_pm_live_root.rs; apps/conary/src/commands/update.rs; apps/conary/src/commands/repo.rs	verified	archived	Archived from the top-level plans directory after Slice B Conary-owned update parity, adopted-package authority, and security-advisory refusal proof landed.
docs/superpowers/plans/archive/2026-05-15-native-package-manager-parity-slice-c-plan.md	docs/superpowers/plans/archive/2026-05-15-native-package-manager-parity-slice-c-plan.md	historical	historical	native-package-manager-parity; implementation-plan; daily-driver-commands; public-preview	docs/INTEGRATION-TESTING.md; apps/conary/tests/native_pm_daily_driver.rs; apps/conary/src/commands/query/package.rs; apps/conary/src/commands/remove.rs	verified	archived	Archived from the top-level plans directory after Slice C daily-driver command parity and provider/breakage diagnostics proof landed.
docs/superpowers/plans/archive/2026-05-16-native-package-manager-parity-slice-d-plan.md	docs/superpowers/plans/archive/2026-05-16-native-package-manager-parity-slice-d-plan.md	historical	historical	native-package-manager-parity; implementation-plan; conary-test-matrix; public-preview	docs/INTEGRATION-TESTING.md; apps/conary/tests/integration/remi/manifests/phase4-native-pm-parity.toml; apps/conary-test/src/engine/runner.rs	verified	archived	Archived from the top-level plans directory after the three-distro Phase 4 native package-manager parity matrix evidence landed.
docs/superpowers/plans/archive/2026-05-20-goal6-recovery-boot-artifact-trust.md	docs/superpowers/plans/archive/2026-05-20-goal6-recovery-boot-artifact-trust.md	historical	historical	daily-driver-readiness; goal6; iso-export; artifact-provenance	docs/superpowers/specs/archive/2026-05-19-daily-driver-readiness-program-design.md; docs/operations/post-generation-export-follow-up-roadmap.md; docs/INTEGRATION-TESTING.md; crates/conary-core/src/generation/export.rs; apps/conary/tests/integration/remi/manifests/phase3-group-p-iso-export.toml	verified	archived	Archived after Goal 6 recovery/artifact trust landed, Group P ISO evidence passed, and active docs carried the x86_64 ISO/provenance status.
docs/superpowers/plans/archive/2026-05-21-goal7-daily-ux-operator-polish.md	docs/superpowers/plans/archive/2026-05-21-goal7-daily-ux-operator-polish.md	historical	historical	daily-driver-readiness; goal7; cli-ux; shell-completions	docs/superpowers/specs/archive/2026-05-19-daily-driver-readiness-program-design.md; docs/operations/daily-driver-ux-matrix.md; apps/conary/tests/cli_daily_ux.rs; README.md; ROADMAP.md	verified	archived	Archived after Goal 7 CLI diagnostics, UX matrix, shell completion checks, and active user/operator doc updates landed.
docs/superpowers/plans/archive/2026-05-22-daily-driver-readiness-completion-validation.md	docs/superpowers/plans/archive/2026-05-22-daily-driver-readiness-completion-validation.md	historical	historical	daily-driver-readiness; completion-validation; release-honesty	docs/superpowers/specs/archive/2026-05-19-daily-driver-readiness-program-design.md; docs/superpowers/daily-driver-readiness-completion-audit-2026-05-22.md; scripts/local-qemu-validation.sh; docs/superpowers/documentation-accuracy-audit-ledger.tsv	verified	archived	Archived after the completion-validation audit landed and Goal 1 superseded the handoff blocker with selected-generation handoff proof.
docs/superpowers/plans/archive/2026-05-22-goal1-native-authority-handoff.md	docs/superpowers/plans/archive/2026-05-22-goal1-native-authority-handoff.md	historical	historical	daily-driver-readiness; goal1; native-authority-handoff; recovery	docs/superpowers/specs/archive/2026-05-19-daily-driver-readiness-program-design.md; apps/conary/src/commands/adopt/native_handoff.rs; apps/conary/tests/integration/remi/manifests/phase3-active-generation-handoff.toml; docs/INTEGRATION-TESTING.md; README.md; ROADMAP.md	verified	archived	Archived after selected-generation native handoff landed with dry-run, refusal, apply, and recovery coverage across Fedora 44, Ubuntu 26.04 LTS, and Arch.
docs/superpowers/release-security-waivers-2026-05-06.md	docs/superpowers/release-security-waivers-2026-05-06.md	planning	maintainer	security-waiver; cargo-audit; release-gate	scripts/release-cargo-audit.sh; Cargo.lock; docs/superpowers/limited-preview-release-checkpoint-2026-05-16.md; docs/superpowers/specs/archive/2026-05-19-daily-driver-readiness-program-design.md	verified	corrected	Added the release cargo-audit waiver record for the remaining rsa advisory, tied it to the scripted audit gate, and revisited it after Goal 3 added no new RSA dependency or private-key reachability.
docs/superpowers/specs/2026-05-26-limited-preview-release-hardening-design.md	docs/superpowers/specs/2026-05-26-limited-preview-release-hardening-design.md	planning	maintainer	limited-preview; release-hardening; ecosystem-positioning; roadmap; design	README.md; ROADMAP.md; CHANGELOG.md; docs/INTEGRATION-TESTING.md; docs/SCRIPTLET_SECURITY.md; docs/modules/source-selection.md; 2026-05-26 review thread	verified	corrected	Added active umbrella design that turns the multi-model release review findings into four sequenced plans, then tightened it with DeepSeek/Gemini/agentic follow-up around Remi latency, live-mutation acknowledgement, adoption-only DB checkpoints and recovery, SQLite-native generation backups, allowlist support bundles, namespace preflight diagnostics, first-tester supportability rigor, and bounded first-run onboarding.
docs/superpowers/specs/archive/2026-05-25-preview-invariant-hardening-design.md	docs/superpowers/specs/archive/2026-05-25-preview-invariant-hardening-design.md	historical	historical	preview-hardening; command-risk; adoption; CAS; generation-publication; recovery; crash-consistency; durable-fsync; implementation; docs-truth	AGENTS.md; docs/ARCHITECTURE.md; apps/conary/src/dispatch.rs; apps/conary/src/commands/adopt; apps/conary/src/commands/changeset_metadata.rs; crates/conary-core/src/filesystem/cas.rs; crates/conary-core/src/db/models/generation_publication.rs; apps/conary/src/commands/generation/publication.rs; crates/conary-core/src/transaction/recovery.rs; crates/conary-core/src/generation/mount.rs; crates/conary-core/src/filesystem/durable.rs; docs/superpowers/specs/archive/2026-05-26-generation-publication-durability-design.md; docs/superpowers/specs/archive/2026-05-26-docs-ci-truth-checks-design.md; docs/superpowers/plans/archive/2026-05-26-docs-ci-truth-checks.md; docs/superpowers/documentation-accuracy-audit-ledger.tsv	verified	archived	Archived from docs/superpowers/specs/2026-05-25-preview-invariant-hardening-design.md after the preview invariant hardening milestone completed: Plan A adoption safety and integrity, Plan B generation publication durability, and Plan C docs/CI truth checks all landed with CI-backed verification.
docs/superpowers/specs/archive/2026-05-26-docs-ci-truth-checks-design.md	docs/superpowers/specs/archive/2026-05-26-docs-ci-truth-checks-design.md	historical	historical	docs-truth; ci; conaryd; schema; policykit; command-drift; preview-hardening	docs/superpowers/specs/archive/2026-05-25-preview-invariant-hardening-design.md; docs/superpowers/plans/archive/2026-05-26-docs-ci-truth-checks.md; .github/workflows/pr-gate.yml; scripts/check-doc-audit-ledger.sh; scripts/docs-audit-inventory.sh; crates/conary-core/src/db/schema.rs; apps/conaryd/src/daemon/routes; apps/conaryd/src/daemon/auth.rs; apps/conaryd/src/daemon/mod.rs; crates/conary-core/src/lib.rs; crates/conary-core/Cargo.toml	verified	archived	Archived from docs/superpowers/specs/2026-05-26-docs-ci-truth-checks-design.md after the preview invariant hardening milestone completed: Plan A adoption safety and integrity, Plan B generation publication durability, and Plan C docs/CI truth checks all landed with CI-backed verification.
docs/superpowers/specs/archive/2026-05-26-generation-publication-durability-design.md	docs/superpowers/specs/archive/2026-05-26-generation-publication-durability-design.md	historical	historical	generation-publication; recovery; crash-consistency; durable-fsync; implementation-design; implementation	docs/superpowers/specs/archive/2026-05-25-preview-invariant-hardening-design.md; docs/superpowers/plans/archive/2026-05-26-generation-publication-durability.md; crates/conary-core/src/db/models/generation_publication.rs; apps/conary/src/commands/generation/publication.rs; crates/conary-core/src/transaction/recovery.rs; crates/conary-core/src/generation/mount.rs; crates/conary-core/src/filesystem/durable.rs; apps/conary/src/commands/composefs_ops.rs; apps/conary/src/commands/install/mod.rs; apps/conary/src/commands/install/batch.rs; apps/conary/src/commands/remove.rs; apps/conary/src/commands/changeset_metadata.rs	verified	archived	Archived from docs/superpowers/specs/2026-05-26-generation-publication-durability-design.md after the preview invariant hardening milestone completed: Plan A adoption safety and integrity, Plan B generation publication durability, and Plan C docs/CI truth checks all landed with CI-backed verification.
docs/superpowers/specs/archive/2026-05-22-llm-native-operations-surface-design.md	docs/superpowers/specs/archive/2026-05-22-llm-native-operations-surface-design.md	historical	historical	llm-native-operations; mcp-adapter; historical-framing	docs/operations/agent-mcp-adapter-decision.md; crates/conary-mcp/src/stateless.rs; crates/conary-mcp/src/stateless_http.rs; apps/conary-test/src/bootstrap.rs	verified	archived	Archived completed LLM-native operations surface design from the active specs lane after the implementation series landed.
docs/superpowers/specs/archive/2026-05-22-stateless-mcp-adapter-compliance-design.md	docs/superpowers/specs/archive/2026-05-22-stateless-mcp-adapter-compliance-design.md	historical	historical	llm-native-operations; mcp-adapter; historical-framing	docs/operations/agent-mcp-adapter-decision.md; crates/conary-mcp/src/stateless.rs; crates/conary-mcp/src/stateless_http.rs; apps/conary-test/src/bootstrap.rs	verified	archived	Archived completed stateless MCP adapter compliance design from the active specs lane after the harness and raw proof work landed.
docs/superpowers/specs/archive/2026-05-24-conary-test-bootstrap-status-resource-design.md	docs/superpowers/specs/archive/2026-05-24-conary-test-bootstrap-status-resource-design.md	historical	historical	mcp; bootstrap-status; historical-framing	apps/conary-test/src/bootstrap.rs; crates/conary-mcp/src/stateless_http.rs; apps/conary-test/src/server/stateless_mcp.rs	verified	archived	Archived completed bootstrap-status stateless resource design from the active specs lane after implementation and docs landed.
docs/superpowers/specs/archive/2026-05-24-conary-test-stateless-discover-route-design.md	docs/superpowers/specs/archive/2026-05-24-conary-test-stateless-discover-route-design.md	historical	historical	mcp; conary-test; stateless-discovery; historical-framing	crates/conary-mcp/src/stateless_http.rs; apps/conary-test/src/server/routes.rs; apps/conary-test/src/server/mcp.rs; docs/operations/agent-mcp-adapter-decision.md	verified	archived	Archived completed conary-test stateless discovery route design from the active specs lane after implementation and follow-on resources landed.
docs/superpowers/specs/archive/2026-05-24-conary-test-suites-resource-design.md	docs/superpowers/specs/archive/2026-05-24-conary-test-suites-resource-design.md	historical	historical	mcp; conary-test-suites; historical-framing	docs/superpowers/specs/archive/2026-05-24-conary-test-bootstrap-status-resource-design.md; apps/conary-test/src/server/service.rs; apps/conary-test/src/server/stateless_mcp.rs; apps/conary-test/src/config/manifest.rs	verified	archived	Archived completed conary-test suites stateless resource design from the active specs lane after final acceptance passed.
docs/superpowers/specs/archive/2026-05-24-stateless-raw-http-adapter-proof-design.md	docs/superpowers/specs/archive/2026-05-24-stateless-raw-http-adapter-proof-design.md	historical	historical	llm-native-operations; mcp-adapter; raw-http-proof; historical-framing	docs/operations/agent-mcp-adapter-decision.md; crates/conary-mcp/src/stateless.rs; crates/conary-mcp/src/stateless_http.rs; apps/conary-test/src/bootstrap.rs	verified	archived	Archived completed stateless raw HTTP adapter proof design from the active specs lane after proof and live conary-test route slices landed.
