origin_path	path	family	audience	claim_clusters	evidence_sources	status	disposition	notes
docs/superpowers/plans/2026-06-06-project-maintainability-phase13-update-module-completion-decomposition-plan.md	docs/superpowers/plans/2026-06-06-project-maintainability-phase13-update-module-completion-decomposition-plan.md	planning	maintainer	maintainability; phase13; update; module-hub; hotspot-decomposition	apps/conary/src/commands/update/mod.rs; apps/conary/src/commands/update/package.rs; apps/conary/src/commands/update/source_policy.rs; apps/conary/src/commands/update/pinning.rs; apps/conary/src/commands/update/delta_stats.rs; apps/conary/src/commands/update/selection.rs; apps/conary/src/commands/update/adopted_authority.rs; apps/conary/src/commands/update/collection.rs; apps/conary/src/commands/mod.rs; apps/conary/src/dispatch.rs; apps/conary/tests/query.rs; apps/conary/tests/cli_daily_ux.rs; apps/conary/tests/native_pm_live_root.rs; docs/modules/source-selection.md; docs/modules/feature-ownership.md	verified	corrected	Added Phase 13 plan for completing the update module decomposition by turning update/mod.rs into a routing hub while moving package update execution, source-policy previewing, pinning commands, and delta statistics into focused update submodules.
docs/superpowers/plans/2026-06-06-project-maintainability-phase14-remi-conversion-service-decomposition-plan.md	docs/superpowers/plans/2026-06-06-project-maintainability-phase14-remi-conversion-service-decomposition-plan.md	planning	maintainer	maintainability; phase14; remi; conversion-service; hotspot-decomposition	apps/remi/src/server/conversion.rs; apps/remi/src/server/conversion/types.rs; apps/remi/src/server/conversion/test_support.rs; apps/remi/src/server/conversion/metadata.rs; apps/remi/src/server/conversion/safety.rs; apps/remi/src/server/conversion/lookup.rs; apps/remi/src/server/conversion/storage.rs; apps/remi/src/server/conversion/persistence.rs; apps/remi/src/server/conversion/recipe.rs; apps/remi/src/server/conversion/benchmark.rs; apps/remi/src/server/conversion/workflow.rs; apps/remi/src/server/publication.rs; apps/remi/src/server/conversion_timing.rs; apps/remi/src/server/scriptlet_corpus.rs; apps/remi/src/server/prewarm.rs; apps/remi/src/server/handlers/packages.rs; apps/remi/src/server/handlers/index.rs; apps/remi/src/server/jobs.rs; apps/remi/src/bin/remi.rs; apps/conary/tests/conversion_integration.rs; docs/modules/remi.md; docs/modules/test-fixtures.md; docs/modules/feature-ownership.md; docs/llms/subsystem-map.md; docs/conaryopedia-v2.md	verified	corrected	Added Phase 14 plan for decomposing the full Remi conversion service hotspot into focused child modules while preserving public conversion APIs, publication gating, benchmark evidence, recipe SSRF safety, CAS/R2 storage, and conversion integration behavior.
docs/superpowers/plans/2026-06-07-project-maintainability-phase15-ccs-install-completion-decomposition-plan.md	docs/superpowers/plans/2026-06-07-project-maintainability-phase15-ccs-install-completion-decomposition-plan.md	planning	maintainer	maintainability; phase15; ccs-install; hotspot-decomposition; capability-policy; dependency-validation	apps/conary/src/commands/ccs/install.rs; apps/conary/src/commands/ccs/payload_paths.rs; apps/conary/src/commands/ccs/mod.rs; apps/conary/src/commands/install/conversion.rs; apps/conary/src/commands/install/ccs_transaction.rs; apps/conary/tests/component.rs; apps/conary/tests/bundle_replay.rs; apps/conary/tests/conversion_integration.rs; scripts/line-count-report.sh; docs/modules/ccs.md; docs/modules/feature-ownership.md	verified	corrected	Added the Phase 15 CCS install completion decomposition plan to split the remaining CCS install hotspot into command orchestration, dependency validation, component selection, capability policy, and focused command test modules while preserving payload path ownership and public command re-exports.
docs/superpowers/plans/2026-06-07-project-maintainability-phase16-install-module-completion-decomposition-plan.md	docs/superpowers/plans/2026-06-07-project-maintainability-phase16-install-module-completion-decomposition-plan.md	planning	maintainer	maintainability; phase16; install-module; hotspot-decomposition; native-install; live-root-safety	apps/conary/src/commands/install/mod.rs; apps/conary/src/commands/install/batch.rs; apps/conary/src/commands/install/inner.rs; apps/conary/src/commands/install/restore.rs; apps/conary/src/commands/install/ccs_transaction.rs; apps/conary/src/commands/install/conversion.rs; apps/conary/src/commands/update/package.rs; apps/conary/src/commands/update/collection.rs; apps/conary/tests/bundle_replay.rs; apps/conary/tests/live_host_mutation_safety.rs; apps/conary/tests/workflow.rs; scripts/line-count-report.sh; docs/modules/feature-ownership.md; docs/modules/source-selection.md; docs/llms/subsystem-map.md	verified	corrected	Added the Phase 16 install module completion decomposition plan to finish splitting install/mod.rs into focused command, acquisition, validation, dependency-flow, execution-path, lifecycle, transaction, option, semantic, and source-policy owners while preserving public install routes and sibling helper re-exports.
docs/superpowers/project-maintainability-dead-surface-inventory-2026-06-06.md	docs/superpowers/project-maintainability-dead-surface-inventory-2026-06-06.md	planning	maintainer	maintainability; phase2; dead-surface-inventory; pruning-queue	AGENTS.md; docs/llms/README.md; docs/superpowers/plans/2026-06-06-project-maintainability-agent-readiness-roadmap.md; docs/superpowers/plans/2026-06-06-project-maintainability-phase2-dead-surface-pruning-plan.md; data/distros.toml; apps/conary/src/cli/repo.rs; apps/conary/src/commands/ccs/init.rs; apps/remi/src/bin/remi.rs	verified	corrected	Added the Phase 2 dead-surface inventory with fixed public CLI strings, intentional internal/parser/archive surfaces, deferred behavior-changing candidates, and refresh commands.
docs/superpowers/specs/2026-06-06-live-system-mutation-ux-redesign.md	docs/superpowers/specs/2026-06-06-live-system-mutation-ux-redesign.md	planning	maintainer	live-mutation; contributor-ux; command-risk; conaryd; safety	AGENTS.md; docs/superpowers/plans/2026-06-06-project-maintainability-agent-readiness-roadmap.md; docs/modules/feature-ownership.md; docs/operations/daily-driver-ux-matrix.md; apps/conary/src/command_risk.rs; apps/conary/src/live_host_safety.rs; apps/conary/src/cli/mod.rs; apps/conary/src/dispatch.rs; apps/conary/tests/live_host_mutation_safety.rs; apps/conary/tests/cli_daily_ux.rs; apps/conaryd/src/daemon/package_ops.rs; apps/conaryd/src/daemon/routes.rs; apps/conary-test/src/config/mod.rs	verified	corrected	Added the live-system mutation UX redesign spec for replacing the global acknowledgement flag with a risk-tiered mutation intent model while preserving active-host, generation, recovery, and daemon safety gates.
docs/superpowers/plans/archive/2026-05-26-scriptlet-trust-assurance.md	docs/superpowers/plans/archive/2026-05-26-scriptlet-trust-assurance.md	historical	historical	scriptlet-security; sandbox-assurance; namespace-preflight; capability-declarations; implementation-plan	docs/superpowers/specs/archive/2026-05-26-limited-preview-release-hardening-design.md; docs/SCRIPTLET_SECURITY.md; crates/conary-core/src/container/mod.rs; crates/conary-core/src/capability/declaration.rs; apps/conary/src/commands/install/scriptlets.rs; apps/conary/src/commands/changeset_metadata.rs	verified	archived	Archived after protected scriptlet sandbox assurance landed: live-root seccomp/preflight checks, typed outcomes, root-transition wording, readable namespace diagnostics, structured warning metadata, history surfacing, and capability-scoped integration hooks are active.
docs/superpowers/plans/archive/2026-05-26-generation-state-resilience.md	docs/superpowers/plans/archive/2026-05-26-generation-state-resilience.md	historical	historical	generation-state; sqlite-recovery; sqlite-backup; implementation-plan	docs/superpowers/specs/archive/2026-05-26-limited-preview-release-hardening-design.md; crates/conary-core/src/db; apps/conary/src/commands/generation; apps/conary/src/commands/adopt; docs/ARCHITECTURE.md; docs/conaryopedia-v2.md	verified	archived	Archived from docs/superpowers/plans/2026-05-26-generation-state-resilience.md after Plan D landed: live-mutation inventory, adoption-lane checkpoints, non-generation DB recovery, generation-bound SQLite-native backups, verification, and copied-backup dry-run recovery are active.
docs/superpowers/plans/archive/2026-05-26-preview-truth-and-onboarding.md	docs/superpowers/plans/archive/2026-05-26-preview-truth-and-onboarding.md	historical	historical	preview-truth; onboarding; docs-truth; adoption; implementation-plan	docs/superpowers/specs/archive/2026-05-26-limited-preview-release-hardening-design.md; README.md; CHANGELOG.md; ROADMAP.md; scripts/check-doc-truth.sh; site/src/routes	verified	archived	Archived from docs/superpowers/plans/2026-05-26-preview-truth-and-onboarding.md after Plan A landed: bounded onboarding, live-mutation acknowledgement, Remi cold-start caveat, Nix comparison, docs-truth coverage, source-selection documentation, single-package dry-run routing, and init diagnostics are active.
docs/superpowers/plans/archive/2026-05-26-release-evidence-and-supportability.md	docs/superpowers/plans/archive/2026-05-26-release-evidence-and-supportability.md	historical	historical	release-evidence; artifact-matrix; supportability; beta-feedback; implementation-plan	docs/superpowers/specs/archive/2026-05-26-limited-preview-release-hardening-design.md; scripts/check-release-matrix.sh; docs/INTEGRATION-TESTING.md; CONTRIBUTING.md; .github/ISSUE_TEMPLATE/bug_report.md	verified	archived	Archived from docs/superpowers/plans/2026-05-26-release-evidence-and-supportability.md after Plan C landed: artifact matrix, release-matrix gate, allowlist support bundle, privacy tests, beta feedback template, issue-template cleanup, and dated evidence guidance are active.
docs/superpowers/plans/archive/2026-05-25-adoption-safety-and-integrity.md	docs/superpowers/plans/archive/2026-05-25-adoption-safety-and-integrity.md	historical	historical	adoption; command-risk; CAS; preview-hardening; implementation-plan	docs/superpowers/specs/archive/2026-05-25-preview-invariant-hardening-design.md; apps/conary/src/dispatch.rs; apps/conary/src/commands/adopt; apps/conary/src/commands/changeset_metadata.rs; crates/conary-core/src/filesystem/cas.rs; apps/conary/tests/live_host_mutation_safety.rs	verified	archived	Archived from docs/superpowers/plans/2026-05-25-adoption-safety-and-integrity.md after the preview invariant hardening milestone completed: Plan A adoption safety and integrity, Plan B generation publication durability, and Plan C docs/CI truth checks all landed with CI-backed verification.
docs/superpowers/plans/archive/2026-05-26-docs-ci-truth-checks.md	docs/superpowers/plans/archive/2026-05-26-docs-ci-truth-checks.md	historical	historical	docs-truth; ci; conaryd; schema; policykit; command-drift; preview-hardening	docs/superpowers/specs/archive/2026-05-26-docs-ci-truth-checks-design.md; scripts/check-doc-audit-ledger.sh; scripts/docs-audit-inventory.sh; .github/workflows/pr-gate.yml; apps/conaryd/src/daemon/routes; apps/conaryd/src/daemon/auth.rs; apps/conaryd/src/daemon/mod.rs; crates/conary-core/Cargo.toml	verified	archived	Archived from docs/superpowers/plans/2026-05-26-docs-ci-truth-checks.md after the preview invariant hardening milestone completed: Plan A adoption safety and integrity, Plan B generation publication durability, and Plan C docs/CI truth checks all landed with CI-backed verification.
docs/superpowers/plans/archive/2026-05-26-generation-publication-durability.md	docs/superpowers/plans/archive/2026-05-26-generation-publication-durability.md	historical	historical	generation-publication; recovery; crash-consistency; durable-fsync; implementation-plan	docs/superpowers/specs/archive/2026-05-26-generation-publication-durability-design.md; crates/conary-core/src/db/models; crates/conary-core/src/generation/mount.rs; crates/conary-core/src/transaction/recovery.rs; apps/conary/src/commands/composefs_ops.rs; apps/conary/src/commands/generation/commands.rs; apps/conary/src/commands/install/mod.rs; apps/conary/src/commands/install/batch.rs; apps/conary/src/commands/remove.rs	verified	archived	Archived from docs/superpowers/plans/2026-05-26-generation-publication-durability.md after the preview invariant hardening milestone completed: Plan A adoption safety and integrity, Plan B generation publication durability, and Plan C docs/CI truth checks all landed with CI-backed verification.
docs/superpowers/plans/archive/2026-05-22-llm-native-operations-surface.md	docs/superpowers/plans/archive/2026-05-22-llm-native-operations-surface.md	historical	historical	llm-native-operations; mcp-adapter; historical-framing	docs/operations/agent-mcp-adapter-decision.md; crates/conary-mcp/src/stateless.rs; crates/conary-mcp/src/stateless_http.rs; apps/conary-test/src/bootstrap.rs	verified	archived	Archived completed LLM-native operations surface plan from the active planning lane after milestone implementation and follow-on stateless/resource slices landed.
docs/superpowers/plans/archive/2026-05-22-local-bootstrap-smoke-proof-loop.md	docs/superpowers/plans/archive/2026-05-22-local-bootstrap-smoke-proof-loop.md	historical	historical	llm-native-operations; bootstrap-smoke; historical-framing	docs/operations/agent-mcp-adapter-decision.md; crates/conary-mcp/src/stateless.rs; crates/conary-mcp/src/stateless_http.rs; apps/conary-test/src/bootstrap.rs	verified	archived	Archived completed local bootstrap smoke proof-loop plan from the active planning lane after implementation and docs landed.
docs/superpowers/plans/archive/2026-05-22-stateless-mcp-adapter-compliance.md	docs/superpowers/plans/archive/2026-05-22-stateless-mcp-adapter-compliance.md	historical	historical	llm-native-operations; mcp-adapter; historical-framing	docs/operations/agent-mcp-adapter-decision.md; crates/conary-mcp/src/stateless.rs; crates/conary-mcp/src/stateless_http.rs; apps/conary-test/src/bootstrap.rs	verified	archived	Archived completed stateless MCP adapter compliance plan from the active planning lane after the harness and decision-record updates landed.
docs/superpowers/plans/archive/2026-05-24-conary-test-bootstrap-status-resource.md	docs/superpowers/plans/archive/2026-05-24-conary-test-bootstrap-status-resource.md	historical	historical	mcp; bootstrap-status; historical-framing	docs/superpowers/specs/archive/2026-05-24-conary-test-bootstrap-status-resource-design.md; crates/conary-mcp/src/stateless.rs; crates/conary-mcp/src/stateless_http.rs; apps/conary-test/src/server/stateless_mcp.rs	verified	archived	Archived completed conary-test bootstrap-status stateless resource plan from the active planning lane after implementation and docs landed.
docs/superpowers/plans/archive/2026-05-24-conary-test-stateless-discover-route.md	docs/superpowers/plans/archive/2026-05-24-conary-test-stateless-discover-route.md	historical	historical	mcp; conary-test; stateless-discovery; historical-framing	docs/superpowers/specs/archive/2026-05-24-conary-test-stateless-discover-route-design.md; apps/conary-test/src/server/routes.rs; crates/conary-mcp/src/stateless_http.rs	verified	archived	Archived completed conary-test stateless discovery route plan from the active planning lane after implementation and follow-on resources landed.
docs/superpowers/plans/archive/2026-05-24-conary-test-suites-resource.md	docs/superpowers/plans/archive/2026-05-24-conary-test-suites-resource.md	historical	historical	mcp; conary-test-suites; historical-framing	docs/superpowers/specs/archive/2026-05-24-conary-test-suites-resource-design.md; apps/conary-test/src/server/stateless_mcp.rs; apps/conary-test/src/bootstrap.rs; apps/conary-test/src/config/manifest.rs	verified	archived	Archived completed conary-test suites stateless resource plan from the active planning lane after final acceptance passed.
docs/superpowers/plans/archive/2026-05-24-stateless-raw-http-adapter-proof.md	docs/superpowers/plans/archive/2026-05-24-stateless-raw-http-adapter-proof.md	historical	historical	llm-native-operations; mcp-adapter; raw-http-proof; historical-framing	docs/operations/agent-mcp-adapter-decision.md; crates/conary-mcp/src/stateless.rs; crates/conary-mcp/src/stateless_http.rs; apps/conary-test/src/bootstrap.rs	verified	archived	Archived completed stateless raw HTTP adapter proof plan from the active planning lane after the proof and live conary-test route slices landed.
docs/superpowers/plans/archive/2026-04-10-all-tracks-release-hardening-plan.md	docs/superpowers/plans/archive/2026-04-10-all-tracks-release-hardening-plan.md	historical	historical	release-plan; historical-framing	docs/superpowers/archive/2026-04-10-release-hardening-checklist.md; docs/operations/infrastructure.md; scripts/release.sh	verified	archived	Archived from docs/superpowers/plans/2026-04-10-all-tracks-release-hardening-plan.md after release-hardening work moved into historical reference.
docs/superpowers/plans/archive/2026-04-16-conaryd-forge-staging-deployment-plan.md	docs/superpowers/plans/archive/2026-04-16-conaryd-forge-staging-deployment-plan.md	historical	historical	conaryd-deploy-plan; historical-framing	deploy/FORGE.md; docs/operations/infrastructure.md; scripts/conaryd-health.sh	verified	archived	Archived from docs/superpowers/plans/2026-04-16-conaryd-forge-staging-deployment-plan.md; current conaryd readiness docs live in README and architecture docs.
docs/superpowers/plans/archive/2026-04-22-generation-artifact-export-unification-plan.md	docs/superpowers/plans/archive/2026-04-22-generation-artifact-export-unification-plan.md	historical	historical	generation-export-plan; historical-framing	docs/operations/post-generation-export-follow-up-roadmap.md; docs/INTEGRATION-TESTING.md; crates/conary-core/src/generation/export.rs	verified	archived	Archived from docs/superpowers/plans/2026-04-22-generation-artifact-export-unification-plan.md; ISO remained a follow-up, and OCI source loading has since moved onto the generation artifact contract.
docs/superpowers/plans/archive/2026-04-30-installed-runtime-generations-self-contained-plan.md	docs/superpowers/plans/archive/2026-04-30-installed-runtime-generations-self-contained-plan.md	historical	historical	installed-runtime-plan; historical-framing	docs/operations/post-generation-export-follow-up-roadmap.md; docs/INTEGRATION-TESTING.md; crates/conary-core/src/generation/builder/runtime_inputs.rs	verified	archived	Archived from docs/superpowers/plans/2026-04-30-installed-runtime-generations-self-contained-plan.md after installed-runtime export moved into validated current docs.
docs/superpowers/plans/archive/2026-05-02-audit-hardening-plan.md	docs/superpowers/plans/archive/2026-05-02-audit-hardening-plan.md	historical	historical	audit-hardening; historical-framing	README.md; ROADMAP.md; apps/conaryd/src/daemon/routes/transactions.rs; docs/superpowers/plans/archive/2026-05-06-limited-public-release-readiness-plan.md	verified	archived	Archived after blocklist, mount fallback, conaryd route honesty, distro catalog, and security-audit items were either completed or carried forward explicitly.
docs/superpowers/plans/archive/2026-05-02-redesign-followups-plan.md	docs/superpowers/plans/archive/2026-05-02-redesign-followups-plan.md	historical	historical	redesign-followups; historical-framing	README.md; ROADMAP.md; docs/superpowers/plans/archive/2026-05-06-limited-public-release-readiness-plan.md	verified	archived	Archived after release-scoped follow-ups were separated from deferred redesign work such as unwrap cleanup and conaryd package executor design.
docs/superpowers/plans/archive/2026-05-06-limited-public-release-readiness-plan.md	docs/superpowers/plans/archive/2026-05-06-limited-public-release-readiness-plan.md	historical	historical	release-readiness; validation; public-preview	README.md; ROADMAP.md; docs/superpowers/limited-preview-release-checkpoint-2026-05-16.md; docs/superpowers/limited-preview-subreddit-tester-post-2026-05-19.md; scripts/release-cargo-audit.sh	verified	archived	Archived from the top-level plans directory after the current limited-preview decision moved to the checkpoint and tester-post docs; retained as the historical release-gate plan.
docs/superpowers/plans/archive/2026-05-12-composefs-atomic-modernization-plan.md	docs/superpowers/plans/archive/2026-05-12-composefs-atomic-modernization-plan.md	historical	historical	composefs-modernization; generation-contract; historical-framing	docs/superpowers/specs/archive/2026-05-12-composefs-atomic-modernization-design.md; docs/INTEGRATION-TESTING.md; docs/operations/post-generation-export-follow-up-roadmap.md; crates/conary-core/src/transaction/mod.rs	verified	archived	Archived after composefs atomic switching implementation, validation, merge, and push to main; active docs now record next-boot selection and Group N evidence.
docs/superpowers/plans/archive/2026-05-14-adopt-without-regret-plan.md	docs/superpowers/plans/archive/2026-05-14-adopt-without-regret-plan.md	historical	historical	adoption; unadopt; implementation-plan; public-preview	README.md; ROADMAP.md; docs/INTEGRATION-TESTING.md; apps/conary/tests/integration/remi/manifests/phase1-advanced.toml	verified	archived	Archived from the top-level plans directory after the Adopt Without Regret implementation and three-distro unadoption proof landed; active docs carry the current adoption boundary.
docs/superpowers/plans/archive/2026-05-14-limited-preview-honesty-first-pass-plan.md	docs/superpowers/plans/archive/2026-05-14-limited-preview-honesty-first-pass-plan.md	historical	historical	codebase-honesty; implementation-plan; public-preview	README.md; ROADMAP.md; docs/ARCHITECTURE.md; apps/conaryd/src/daemon/routes/transactions.rs	verified	archived	Archived from the top-level plans directory after the first honesty pass landed; current preview caveats live in README, ROADMAP, integration docs, and the limited-preview checkpoint.
docs/superpowers/plans/archive/2026-05-14-native-package-manager-parity-slice-a-plan.md	docs/superpowers/plans/archive/2026-05-14-native-package-manager-parity-slice-a-plan.md	historical	historical	native-package-manager-parity; implementation-plan; install-remove; public-preview	docs/INTEGRATION-TESTING.md; apps/conary/tests/native_pm_live_root.rs; apps/conary/src/commands/install/mod.rs; apps/conary/src/commands/remove.rs	verified	archived	Archived from the top-level plans directory after Slice A no-generation install/remove behavior landed and later slices built on it.
docs/superpowers/plans/archive/2026-05-15-native-package-manager-parity-slice-b-plan.md	docs/superpowers/plans/archive/2026-05-15-native-package-manager-parity-slice-b-plan.md	historical	historical	native-package-manager-parity; implementation-plan; update; security-updates; public-preview	docs/INTEGRATION-TESTING.md; apps/conary/tests/native_pm_live_root.rs; apps/conary/src/commands/update.rs; apps/conary/src/commands/repo.rs	verified	archived	Archived from the top-level plans directory after Slice B Conary-owned update parity, adopted-package authority, and security-advisory refusal proof landed.
docs/superpowers/plans/archive/2026-05-15-native-package-manager-parity-slice-c-plan.md	docs/superpowers/plans/archive/2026-05-15-native-package-manager-parity-slice-c-plan.md	historical	historical	native-package-manager-parity; implementation-plan; daily-driver-commands; public-preview	docs/INTEGRATION-TESTING.md; apps/conary/tests/native_pm_daily_driver.rs; apps/conary/src/commands/query/package.rs; apps/conary/src/commands/remove.rs	verified	archived	Archived from the top-level plans directory after Slice C daily-driver command parity and provider/breakage diagnostics proof landed.
docs/superpowers/plans/archive/2026-05-16-native-package-manager-parity-slice-d-plan.md	docs/superpowers/plans/archive/2026-05-16-native-package-manager-parity-slice-d-plan.md	historical	historical	native-package-manager-parity; implementation-plan; conary-test-matrix; public-preview	docs/INTEGRATION-TESTING.md; apps/conary/tests/integration/remi/manifests/phase4-native-pm-parity.toml; apps/conary-test/src/engine/runner.rs	verified	archived	Archived from the top-level plans directory after the three-distro Phase 4 native package-manager parity matrix evidence landed.
docs/superpowers/plans/archive/2026-05-20-goal6-recovery-boot-artifact-trust.md	docs/superpowers/plans/archive/2026-05-20-goal6-recovery-boot-artifact-trust.md	historical	historical	daily-driver-readiness; goal6; iso-export; artifact-provenance	docs/superpowers/specs/archive/2026-05-19-daily-driver-readiness-program-design.md; docs/operations/post-generation-export-follow-up-roadmap.md; docs/INTEGRATION-TESTING.md; crates/conary-core/src/generation/export.rs; apps/conary/tests/integration/remi/manifests/phase3-group-p-iso-export.toml	verified	archived	Archived after Goal 6 recovery/artifact trust landed, Group P ISO evidence passed, and active docs carried the x86_64 ISO/provenance status.
docs/superpowers/plans/archive/2026-05-21-goal7-daily-ux-operator-polish.md	docs/superpowers/plans/archive/2026-05-21-goal7-daily-ux-operator-polish.md	historical	historical	daily-driver-readiness; goal7; cli-ux; shell-completions	docs/superpowers/specs/archive/2026-05-19-daily-driver-readiness-program-design.md; docs/operations/daily-driver-ux-matrix.md; apps/conary/tests/cli_daily_ux.rs; README.md; ROADMAP.md	verified	archived	Archived after Goal 7 CLI diagnostics, UX matrix, shell completion checks, and active user/operator doc updates landed.
