origin_path	path	family	audience	claim_clusters	evidence_sources	status	disposition	notes
.github/ISSUE_TEMPLATE/beta_feedback.md	.github/ISSUE_TEMPLATE/beta_feedback.md	template	contributor	workflow-template; beta-feedback; support-bundle	.github/ISSUE_TEMPLATE/bug_report.md; docs/operations/release-artifact-matrix.md; scripts/conary-support-bundle.sh; scripts/test-support-bundle.sh	verified	corrected	Added limited-preview beta feedback intake with preview-lane checkboxes, environment/command fields, and reviewed allowlist support-bundle guidance.
.github/ISSUE_TEMPLATE/bug_report.md	.github/ISSUE_TEMPLATE/bug_report.md	template	contributor	workflow-template; distro-baseline; support-bundle	AGENTS.md; data/distros.toml; apps/conary/tests/integration/remi/config.toml; scripts/conary-support-bundle.sh; scripts/test-support-bundle.sh	verified	corrected	Updated example distro list to Fedora 44, Ubuntu 26.04 LTS, and Arch Linux, then replaced raw debug-log default guidance with reviewed allowlist support-bundle instructions and explicit raw-log caution.
.github/ISSUE_TEMPLATE/feature_request.md	.github/ISSUE_TEMPLATE/feature_request.md	template	contributor	workflow-template	.github/PULL_REQUEST_TEMPLATE.md; CONTRIBUTING.md	verified	verified-no-change	Generic feature-request template remains accurate.
.github/PULL_REQUEST_TEMPLATE.md	.github/PULL_REQUEST_TEMPLATE.md	template	contributor	pull-request-template; verification; ownership; feature-ownership	AGENTS.md; CONTRIBUTING.md; docs/modules/feature-ownership.md; docs/llms/subsystem-map.md	verified	corrected	Added feature ownership and broader interaction-gate checkboxes while keeping the PR template concise and human-facing.
.github/copilot-instructions.md	.github/copilot-instructions.md	template	contributor	assistant-guidance; canonical-routing	AGENTS.md; docs/llms/README.md	verified	verified-no-change	Thin tool-specific entrypoint still points to canonical assistant docs.
AGENTS.md	AGENTS.md	root	contributor	repo-contract; verification; assistant-guidance; maintainability-discipline; refactor-boundaries	docs/llms/README.md; docs/ARCHITECTURE.md; docs/INTEGRATION-TESTING.md; docs/operations/infrastructure.md; docs/superpowers/plans/2026-06-06-project-maintainability-phase1-repo-discipline-contract-plan.md	verified	corrected	Added compact maintainability and refactor discipline: large-file review signals, ownership-boundary expectations, persisted-state/public-surface checks, focused tests, and subsystem-map/doc update guidance.
CHANGELOG.md	CHANGELOG.md	root	contributor	release-history; preview-readiness; conaryd-scope	scripts/release.sh; scripts/release-matrix.sh; docs/superpowers/archive/2026-04-10-release-hardening-checklist.md; scripts/release-cargo-audit.sh; docs/modules/conaryd.md	verified	corrected	Added an Unreleased preview-readiness section, recorded the temporary Forge validation pause plus local QEMU gate, and corrected the conaryd package-route status so it says daemon package jobs are queued instead of returning blanket 501 Not Implemented.
CONTRIBUTING.md	CONTRIBUTING.md	root	contributor	contributing; development; verification; feature-ownership; drift-control	AGENTS.md; docs/llms/README.md; docs/modules/feature-ownership.md; docs/INTEGRATION-TESTING.md; docs/operations/infrastructure.md; Cargo.toml; scripts/line-count-report.sh; scripts/maintainability-drift-report.sh	verified	corrected	Refreshed contributor workflow guidance with feature ownership map routing, focused proof expectations, broader interaction gates, line-count reporting, and warn-only maintainability drift reporting.
GEMINI.md	GEMINI.md	root	contributor	assistant-guidance; canonical-routing	AGENTS.md; docs/llms/README.md	verified	verified-no-change	Thin Gemini entrypoint remains accurate.
README.md	README.md	root	user	product-overview; adoption; generation-export; generation-publication; bootstrap; roadmap; conaryd-scope; daily-driver-ux; release-evidence; support-bundle; scriptlet-security	AGENTS.md; docs/ARCHITECTURE.md; docs/INTEGRATION-TESTING.md; docs/SCRIPTLET_SECURITY.md; docs/operations/post-generation-export-follow-up-roadmap.md; docs/operations/daily-driver-ux-matrix.md; docs/operations/release-artifact-matrix.md; docs/superpowers/limited-preview-release-checkpoint-2026-05-16.md; docs/superpowers/specs/2026-05-26-generation-publication-durability-design.md; apps/conary/src/commands/generation/commands.rs; apps/conary/src/commands/generation/publication.rs; apps/conary/src/commands/system.rs; apps/conary/src/commands/changeset_metadata.rs; crates/conary-core/src/scriptlet/mod.rs; data/distros.toml; scripts/conary-support-bundle.sh	verified	corrected	Refreshed user-facing status for the adoption-led Fedora 44, Ubuntu 26.04 LTS, and Arch package-manager preview matrix; non-destructive unadoption; explicit takeover; Conary-owned no-generation update behavior; security-update advisory support refusal; selected-generation native handoff dry-run/apply/recovery; conaryd package execution scope; the May 21 Group O generation-export pass; x86_64 ISO generation-carrier export with passing Group P evidence; typed whatprovides examples; the Goal 7 daily-driver UX matrix link; Plan B pending generation publication debt inspection/retry commands; Plan C release artifact/support-bundle routing; SQLite-native checkpoint plus generation-bound DB backup recovery commands and boundaries; first-run system init diagnostics for database/runtime-root path failures; and protected scriptlet preflight, warning metadata, and CCS scriptlet capability gating.
ROADMAP.md	ROADMAP.md	root	user	roadmap; validation; adoption; generation-export; public-preview; daily-driver-ux; release-hardening; release-evidence	docs/INTEGRATION-TESTING.md; docs/operations/bootstrap-selfhosting-vm.md; docs/operations/post-generation-export-follow-up-roadmap.md; docs/operations/daily-driver-ux-matrix.md; docs/operations/release-artifact-matrix.md; docs/superpowers/limited-preview-release-checkpoint-2026-05-16.md; docs/superpowers/specs/archive/2026-05-26-limited-preview-release-hardening-design.md; data/distros.toml	verified	corrected	Updated priorities and caveats around adoption-led preview, native package-manager authority, unadopt escape boundaries, explicit takeover, security-update honesty, selected-generation native handoff validation, local QEMU/security gates, the May 21 Group O generation-export boot proof, x86_64 ISO generation-carrier export, passing Group P ISO evidence, non-x86_64 generation boot assets, Goal 7 UX/completion checks, the completed and archived review-derived release-hardening queue, Remi cold-start latency, adoption-lane rollback/post-success DB checkpoints, release artifact/provenance expectations, scriptlet trust-assurance gates, and generation-bound SQLite DB backup verification/recovery status.
SECURITY.md	SECURITY.md	root	contributor	support-status; transaction-safety	CHANGELOG.md; Cargo.toml; data/distros.toml; crates/conary-core/src/generation/export.rs	verified	corrected	Updated supported version line to 0.8.x limited preview and added the Fedora 44, Ubuntu 26.04 LTS, and Arch support scope.
apps/conary-test/README.md	apps/conary-test/README.md	app-local	contributor	mcp; stateless-preview; bootstrap-status; suites-resource	apps/conary-test/src/server/stateless_mcp.rs; apps/conary-test/src/suite_inventory.rs; apps/conary-test/src/bootstrap.rs	verified	corrected	Updated stateless MCP route docs for bootstrap/status and conary-test://suites read-only resources.
apps/conary/tests/fixtures/adversarial/README.md	apps/conary/tests/fixtures/adversarial/README.md	app-local	contributor	test-fixtures; security-validation	apps/conary/tests/fixtures/adversarial/build-all.sh; apps/conary/tests/fixtures/adversarial/build-large.sh	verified	verified-no-change	Fixture guidance still matches the tracked adversarial fixture layout.
apps/conary/tests/scriptlet_harness/README.md	apps/conary/tests/scriptlet_harness/README.md	app-local	contributor	scriptlet-validation; security	crates/conary-core/src/scriptlet/mod.rs; apps/conary/tests/scriptlet_harness/test_scriptlets.py	verified	verified-no-change	Harness README remains accurate after the doc refresh.
bootstrap/stage0/README.md	bootstrap/stage0/README.md	app-local	contributor	bootstrap-history; legacy-toolchain	docs/modules/bootstrap.md; apps/conary/src/cli/bootstrap.rs; bootstrap/stage0/crosstool.config	verified	verified-no-change	Stage0 README remains clearly framed as historical crosstool-ng reference material.
deploy/CLOUDFLARE.md	deploy/CLOUDFLARE.md	deploy	operator	cloudflare; remi-admin; distro-baseline	deploy/remi.toml.example; docs/operations/infrastructure.md; apps/remi/src/server/routes/admin.rs	verified	corrected	Updated the Fedora index example and confirmed MCP/admin-origin proxying language.
deploy/FORGE.md	deploy/FORGE.md	deploy	operator	forge; conaryd-staging; validation	docs/operations/infrastructure.md; scripts/conaryd-health.sh; scripts/deploy-forge.sh; deploy/forge-rollouts.toml	verified	corrected	Marked the old Forge VPS retired, documented replacement-runner KVM checks, required explicit FORGE_HOST, and paused conaryd staging until a replacement host exists.
deploy/dracut/NOTE.md	deploy/dracut/NOTE.md	deploy	operator	boot-integration; deploy-note	packaging/dracut/90conary/module-setup.sh; deploy/dracut/mount-conary.sh	verified	verified-no-change	Deploy-time dracut note remains accurate.
deploy/remi.toml.example	deploy/remi.toml.example	deploy	operator	remi-config; distro-baseline; admin-origin	docs/operations/infrastructure.md; deploy/CLOUDFLARE.md; apps/remi/src/server/config.rs	verified	corrected	Updated Fedora and Ubuntu upstream release config, host-capacity wording, and external admin origin comments.
docs/ARCHITECTURE.md	docs/ARCHITECTURE.md	canonical	contributor	architecture; schema; generation-publication; generation-export; conaryd-scope	crates/conary-core/src/db/schema.rs; crates/conary-core/src/db/models/generation_publication.rs; crates/conary-core/src/generation/builder/runtime_inputs.rs; crates/conary-core/src/generation/export.rs; apps/conaryd/src/daemon/routes/transactions.rs; crates/conary-core/src/db/backup.rs	verified	corrected	Refreshed schema v69, runtime input validation, self-contained artifact export, rootful bootstrap handoff wording, conaryd package-execution scope, and the database-first recovery boundary for SQLite checkpoint plus generation-bound DB backups.
docs/INTEGRATION-TESTING.md	docs/INTEGRATION-TESTING.md	canonical	contributor	integration-testing; adoption; unadopt; qemu; fedora44; daily-driver-ux; native-authority-handoff; release-evidence; support-bundle	apps/conary/tests/integration/remi/manifests/phase1-advanced.toml; apps/conary/tests/integration/remi/manifests/phase3-group-n-qemu.toml; apps/conary/tests/integration/remi/manifests/phase3-group-o-generation-export.toml; apps/conary/tests/integration/remi/manifests/phase3-active-generation-handoff.toml; apps/conary/tests/integration/remi/manifests/phase4-native-pm-parity.toml; apps/conary/tests/fixtures/phase4-daily-driver-corpus/ccs.toml; apps/conary-test/src/config/manifest.rs; apps/conary-test/src/engine/qemu.rs; apps/conary/tests/native_pm_live_root.rs; apps/conary/tests/cli_daily_ux.rs; docs/operations/release-artifact-matrix.md; scripts/conary-support-bundle.sh	verified	corrected	Documented Phase 1 T21a-T21c non-destructive unadoption proof across Fedora 44, Ubuntu 26.04 LTS, and Arch, selected-generation native authority handoff proof across the same three distros, native live-root update/security refusal proof, refreshed Group N and Group O QEMU evidence, passing Group P ISO evidence, focused Slice C daily-driver/provider proof, Goal 7 CLI UX/completion proof, Slice D daily-driver corpus coverage/unsupported classes, 18-test result-gated evidence, local validation notes, dated local-QEMU evidence hygiene, and the first-tester release evidence/support-bundle loop.
docs/SCRIPTLET_SECURITY.md	docs/SCRIPTLET_SECURITY.md	canonical	contributor	scriptlet-security; verification; package-format-scope	crates/conary-core/src/scriptlet/mod.rs; crates/conary-core/src/container/mod.rs; crates/conary-core/src/capability/declaration.rs; crates/conary-core/src/ccs/manifest.rs; apps/conary/src/commands/changeset_metadata.rs; apps/conary/src/commands/query/history.rs	verified	corrected	Clarified DEB-family scriptlet semantics without implying Debian is a public supported distro, then refreshed protected live-root sandbox semantics for private /etc and /var writable layers, enforce-mode scriptlet seccomp without chroot, fail-closed namespace preflight diagnostics, requested/effective sandbox metadata, warning-only post-scriptlet exit degradation, and narrow CCS scriptlet capability declarations.
docs/conaryopedia-v2.md	docs/conaryopedia-v2.md	canonical	contributor	handbook; schema; bootstrap; remi; generation-publication; generation-export; distro-scope; native-authority-handoff; scriptlet-security; update-selection	crates/conary-core/src/db/schema.rs; crates/conary-core/src/db/models/generation_publication.rs; apps/conary/src/cli/bootstrap.rs; apps/conary/src/cli/generation.rs; apps/conary/src/commands/update/mod.rs; apps/conary/src/commands/update/selection.rs; apps/conary/src/commands/adopt/native_handoff.rs; apps/remi/src/server/routes/admin.rs; deploy/remi.toml.example; crates/conary-core/src/db/backup.rs; crates/conary-core/src/scriptlet/mod.rs; crates/conary-core/src/ccs/manifest.rs; apps/conary/src/commands/changeset_metadata.rs; apps/remi/src/server/conversion.rs; apps/remi/src/server/conversion/types.rs; apps/remi/src/server/conversion/test_support.rs; apps/remi/src/server/conversion/workflow.rs; apps/remi/src/server/conversion/persistence.rs; apps/remi/src/server/conversion/lookup.rs; apps/remi/src/server/conversion/metadata.rs; apps/remi/src/server/conversion/safety.rs; apps/remi/src/server/conversion/storage.rs; apps/remi/src/server/conversion/recipe.rs; apps/remi/src/server/conversion/benchmark.rs	verified	corrected	Refreshed Fedora 44 and Ubuntu 26.04 examples, schema v69, LFS 13.0 bootstrap stages, generation export commands, Remi admin access, DEB parser support caveats, adopted-update authority, unadopt escape behavior, selected-generation native handoff guidance, SQLite checkpoint/generation-bound DB recovery commands, security-advisory repository support, typed provider-query examples, protected scriptlet preflight/root-transition/metadata/capability-gating wording, and Phase 10 update module path ownership, and Phase 14 Remi conversion service child-module ownership.
docs/llms/README.md	docs/llms/README.md	canonical	contributor	assistant-guidance; llm-map; feature-ownership; drift-control	AGENTS.md; docs/ARCHITECTURE.md; docs/INTEGRATION-TESTING.md; docs/modules/feature-ownership.md; docs/modules/test-fixtures.md; docs/operations/infrastructure.md; scripts/docs-audit-inventory.sh; scripts/check-doc-audit-ledger.sh; scripts/line-count-report.sh; scripts/maintainability-drift-report.sh	verified	corrected	Refreshed assistant routing to include feature ownership cards, interaction gates, line-count reporting, and warn-only maintainability drift reporting while preserving AGENTS.md as the repo-wide assistant contract.
docs/llms/archive/claude-era-notes.md	docs/llms/archive/claude-era-notes.md	historical	historical	assistant-history; archive	docs/llms/archive/claude-era-notes.md; docs/llms/README.md	verified	retained-historical	Retained as historical Claude-era guidance and updated to say tracked Claude active artifacts were removed.
docs/llms/subsystem-map.md	docs/llms/subsystem-map.md	canonical	contributor	assistant-guidance; subsystem-map; feature-ownership; update-selection; update-adopted-authority; update-collection; update-module-completion; ccs-install-completion	docs/ARCHITECTURE.md; docs/modules/feature-ownership.md; docs/modules/test-fixtures.md; crates/conary-core/src/generation/builder/runtime_inputs.rs; docs/operations/post-generation-export-follow-up-roadmap.md; apps/conary/src/commands/adopt/native_handoff.rs; crates/conary-core/src/ccs/convert; apps/remi/src/server/publication.rs; apps/conary/src/commands/install/mod.rs; apps/conary/src/commands/install/legacy_replay.rs; apps/conary/src/commands/install/inner.rs; apps/conary/src/commands/install/batch.rs; apps/conary/src/commands/install/restore.rs; apps/conary/src/commands/update/mod.rs; apps/conary/src/commands/update/package.rs; apps/conary/src/commands/update/source_policy.rs; apps/conary/src/commands/update/selection.rs; apps/conary/src/commands/update/adopted_authority.rs; apps/conary/src/commands/update/collection.rs; apps/conary/src/commands/update/pinning.rs; apps/conary/src/commands/update/delta_stats.rs; apps/remi/src/server/conversion.rs; apps/remi/src/server/conversion/types.rs; apps/remi/src/server/conversion/test_support.rs; apps/remi/src/server/conversion/workflow.rs; apps/remi/src/server/conversion/persistence.rs; apps/remi/src/server/conversion/lookup.rs; apps/remi/src/server/conversion/metadata.rs; apps/remi/src/server/conversion/safety.rs; apps/remi/src/server/conversion/storage.rs; apps/remi/src/server/conversion/recipe.rs; apps/remi/src/server/conversion/benchmark.rs; apps/conary/src/commands/ccs/install.rs; apps/conary/src/commands/ccs/install/command.rs; apps/conary/src/commands/ccs/install/dependency.rs; apps/conary/src/commands/ccs/install/component_selection.rs; apps/conary/src/commands/ccs/install/capability_policy.rs; apps/conary/src/commands/ccs/payload_paths.rs	verified	corrected	Refreshed subsystem pointers to route feature-scoped work through the feature ownership map while keeping selected-generation, fixture, Remi/CCS, install replay, update selection, update adopted authority, update collection, and implemented Phase 13 update module completion pointers compact, and Phase 14 Remi conversion service child-module ownership, and Phase 15 CCS install child-module ownership.
docs/modules/bootstrap.md	docs/modules/bootstrap.md	canonical	contributor	bootstrap; generation-export; self-hosting	apps/conary/src/cli/bootstrap.rs; crates/conary-core/src/bootstrap/mod.rs; crates/conary-core/src/generation/export.rs; docs/operations/bootstrap-selfhosting-vm.md; docs/INTEGRATION-TESTING.md	verified	corrected	Updated generation artifact export status and self-contained installed-runtime validation language, including the May 19 TGE04 installed-runtime export boot proof.
docs/modules/ccs.md	docs/modules/ccs.md	canonical	contributor	ccs; cli-surface; fixture-proof; ccs-install	apps/conary/src/cli/ccs.rs; docs/specs/ccs-format-v1.md; crates/conary-core/src/ccs/manifest.rs; crates/conary-core/src/ccs/convert/golden_fixtures.rs; crates/conary-core/src/ccs/convert/support_matrix.rs; docs/modules/test-fixtures.md; apps/conary/src/commands/install/legacy_replay.rs; crates/conary-core/src/ccs/legacy_replay.rs; apps/conary/src/commands/ccs/install.rs; apps/conary/src/commands/ccs/install/command.rs; apps/conary/src/commands/ccs/install/dependency.rs; apps/conary/src/commands/ccs/install/component_selection.rs; apps/conary/src/commands/ccs/install/capability_policy.rs; apps/conary/src/commands/ccs/payload_paths.rs	verified	corrected	Added CCS conversion fixture ownership routing, fast proof commands, and legacy scriptlet install-side adapter routing, and CCS install child-module ownership.
docs/modules/test-fixtures.md	docs/modules/test-fixtures.md	canonical	contributor	test-fixtures; fixture-map; remi; ccs; conary-test	docs/superpowers/plans/2026-06-06-project-maintainability-phase3-test-fixture-discipline-plan.md; crates/conary-core/src/ccs/convert/golden_fixtures.rs; crates/conary-core/src/ccs/convert/support_matrix.rs; apps/conary/tests/common/legacy_scriptlet_fixtures.rs; apps/remi/src/server/publication.rs; apps/remi/src/server/conversion.rs; apps/conary-test/src/suite_inventory.rs; apps/conary/tests/integration/remi/manifests; apps/conary/src/commands/install/legacy_replay.rs; apps/remi/src/server/conversion/types.rs; apps/remi/src/server/conversion/test_support.rs; apps/remi/src/server/conversion/workflow.rs; apps/remi/src/server/conversion/persistence.rs; apps/remi/src/server/conversion/lookup.rs; apps/remi/src/server/conversion/metadata.rs; apps/remi/src/server/conversion/safety.rs; apps/remi/src/server/conversion/storage.rs; apps/remi/src/server/conversion/recipe.rs; apps/remi/src/server/conversion/benchmark.rs	verified	corrected	Added the first canonical fixture ownership map for Remi and CCS conversion/publication fixtures, and updated code owner routing for legacy scriptlet bundle fixtures, and Phase 14 Remi conversion service child-module ownership.
docs/modules/feature-ownership.md	docs/modules/feature-ownership.md	canonical	contributor	feature-ownership; contributor-ux; verification; interaction-gates; update-selection; update-adopted-authority; update-collection; update-module-completion; ccs-install-completion	AGENTS.md; CONTRIBUTING.md; docs/llms/README.md; docs/llms/subsystem-map.md; docs/ARCHITECTURE.md; docs/INTEGRATION-TESTING.md; docs/modules/ccs.md; docs/modules/remi.md; docs/modules/conaryd.md; docs/modules/source-selection.md; docs/modules/test-fixtures.md; docs/operations/bootstrap-selfhosting-vm.md; docs/operations/daily-driver-ux-matrix.md; docs/operations/post-generation-export-follow-up-roadmap.md; apps/conary/src/commands/install; apps/conary/src/commands/adopt; apps/conary/src/commands/ccs; apps/conary/src/commands/update/mod.rs; apps/conary/src/commands/update/package.rs; apps/conary/src/commands/update/source_policy.rs; apps/conary/src/commands/update/selection.rs; apps/conary/src/commands/update/adopted_authority.rs; apps/conary/src/commands/update/collection.rs; apps/conary/src/commands/update/pinning.rs; apps/conary/src/commands/update/delta_stats.rs; apps/remi/src/server; apps/conaryd/src/daemon; apps/conary-test/src; crates/conary-core/src/ccs; crates/conary-core/src/generation; crates/conary-agent-contract/src; crates/conary-mcp/src; apps/remi/src/server/conversion.rs; apps/remi/src/server/conversion/types.rs; apps/remi/src/server/conversion/test_support.rs; apps/remi/src/server/conversion/workflow.rs; apps/remi/src/server/conversion/persistence.rs; apps/remi/src/server/conversion/lookup.rs; apps/remi/src/server/conversion/metadata.rs; apps/remi/src/server/conversion/safety.rs; apps/remi/src/server/conversion/storage.rs; apps/remi/src/server/conversion/recipe.rs; apps/remi/src/server/conversion/benchmark.rs; apps/conary/src/commands/ccs/install.rs; apps/conary/src/commands/ccs/install/command.rs; apps/conary/src/commands/ccs/install/dependency.rs; apps/conary/src/commands/ccs/install/component_selection.rs; apps/conary/src/commands/ccs/install/capability_policy.rs; apps/conary/src/commands/ccs/payload_paths.rs	verified	corrected	Added the canonical feature ownership map with start-here paths, neighboring systems, focused proof commands, broader interaction gates, docs routing, safety notes for major Conary capabilities, Phase 10 update module path ownership, Phase 11 update adopted authority path ownership, Phase 12 update collection path ownership, and Phase 13 update module completion ownership, and Phase 14 Remi conversion service child-module ownership, and Phase 15 CCS install child-module ownership.
docs/modules/conaryd.md	docs/modules/conaryd.md	canonical	contributor	conaryd; endpoint-reference; auth; preview-stubs	apps/conaryd/src/daemon/routes/system.rs; apps/conaryd/src/daemon/routes/transactions.rs; apps/conaryd/src/daemon/routes/query.rs; apps/conaryd/src/daemon/routes/events.rs; apps/conaryd/src/daemon/auth.rs; scripts/check-doc-truth.sh	verified	corrected	Added a maintained conaryd module reference with method-aware route inventory, v1 auth-boundary wording, preview-stubbed system route status, and fail-closed PolicyKit authorization wording checked by the docs truth gate.
docs/modules/federation.md	docs/modules/federation.md	canonical	contributor	federation; trust	apps/remi/src/federation/mod.rs; apps/conary/src/cli/federation.rs; docs/operations/infrastructure.md	verified	verified-no-change	Federation guide remains accurate for pinned HTTPS trust expectations.
docs/modules/query.md	docs/modules/query.md	canonical	contributor	query; cli-surface	apps/conary/src/cli/query.rs; apps/conary/src/dispatch.rs; apps/conary/src/commands/query	verified	verified-no-change	Query module guide remains accurate.
docs/modules/recipe.md	docs/modules/recipe.md	canonical	contributor	recipes; kitchen	crates/conary-core/src/recipe/format.rs; crates/conary-core/src/recipe/kitchen/cook.rs; recipes/versions.toml	verified	verified-no-change	Recipe module guide remains accurate.
docs/modules/source-selection.md	docs/modules/source-selection.md	canonical	contributor	source-selection; policy; update-selection; update-adopted-authority; update-collection; update-module-completion	crates/conary-core/src/repository/effective_policy.rs; apps/conary/src/commands/update/mod.rs; apps/conary/src/commands/update/package.rs; apps/conary/src/commands/update/source_policy.rs; apps/conary/src/commands/update/selection.rs; apps/conary/src/commands/update/adopted_authority.rs; apps/conary/src/commands/update/collection.rs; apps/conary/src/commands/update/pinning.rs; apps/conary/src/commands/update/delta_stats.rs; apps/conary/src/commands/model.rs	verified	corrected	Updated update-flow notes for no-generation mutable live-root updates, adopted-package native authority, explicit takeover, security-advisory support refusal, the Phase 10 update module path split, the Phase 11 update adopted authority split, the Phase 12 update collection split, and the implemented Phase 13 update module completion split.
