origin_path	path	family	audience	claim_clusters	evidence_sources	status	disposition	notes
docs/operations/LOCAL_ACCESS.example.md	docs/operations/LOCAL_ACCESS.example.md	template	contributor	local-access-template; secrets-policy	AGENTS.md; docs/operations/infrastructure.md	verified	verified-no-change	Local access template still directs sensitive host notes out of tracked docs.
docs/operations/agent-mcp-adapter-decision.md	docs/operations/agent-mcp-adapter-decision.md	canonical	contributor	mcp; stateless-adapter; bootstrap-status; suites-resource	crates/conary-mcp/src/stateless_http.rs; apps/conary-test/src/server/stateless_mcp.rs; apps/conary-test/src/suite_inventory.rs; docs/superpowers/specs/archive/2026-05-24-conary-test-suites-resource-design.md	verified	corrected	Updated adapter decision current state for conary-test bootstrap/status and suites resources while Remi remains unwired.
docs/operations/bootstrap-follow-up-investigations.md	docs/operations/bootstrap-follow-up-investigations.md	canonical	contributor	bootstrap-follow-up; generation-export	docs/operations/bootstrap-selfhosting-vm.md; docs/operations/post-generation-export-follow-up-roadmap.md; scripts/bootstrap-vm/build-selfhost-qcow2.sh	verified	corrected	Reframed after landed self-hosting and generation-export milestones.
docs/operations/bootstrap-selfhosting-vm.md	docs/operations/bootstrap-selfhosting-vm.md	canonical	contributor	self-hosting-vm; qemu; bootstrap	scripts/bootstrap-vm/build-selfhost-qcow2.sh; scripts/bootstrap-vm/validate-selfhost-vm.sh; recipes/versions.toml	verified	corrected	Updated rootful handoff, 32G qcow2 flow, Tier 2 audit, and validation caveats.
docs/operations/daily-driver-ux-matrix.md	docs/operations/daily-driver-ux-matrix.md	canonical	contributor	daily-driver-ux; cli-diagnostics; shell-completions	README.md; ROADMAP.md; docs/INTEGRATION-TESTING.md; apps/conary/tests/cli_daily_ux.rs; apps/conary/src/cli/mod.rs	verified	corrected	Added checked-in Goal 7 matrix for install/remove/update/search/list/autoremove/pin/unpin diagnostics, unsupported-case routes, live mutation/conaryd guidance, and bash/zsh completion checks.
docs/operations/infrastructure.md	docs/operations/infrastructure.md	canonical	contributor	mcp; operations; bootstrap-status; suites-resource	apps/conary-test/src/server/stateless_mcp.rs; apps/conary-test/src/suite_inventory.rs; docs/operations/agent-mcp-adapter-decision.md	verified	corrected	Updated agent operations guidance to record bootstrap/status and suites stateless preview resources.
docs/operations/live-mutation-backup-inventory.md	docs/operations/live-mutation-backup-inventory.md	canonical	contributor	live-mutation; sqlite-backup; release-hardening	apps/conary/src/command_risk.rs; apps/conary/src/commands/adopt; crates/conary-core/src/db/backup.rs; apps/conaryd/src/daemon/routes/transactions.rs; apps/conary/src/commands/generation/commands.rs; apps/conary/src/commands/generation/publication.rs	verified	corrected	Added and refreshed the first-wave live-mutation backup inventory, covering adoption-lane SQLite checkpoints, generation publication DB backups, verify/recover generation DB commands, and marking remaining package mutation, generation switching, takeover, and conaryd package jobs as excluded or VM-only until follow-up evidence lands.
docs/operations/post-generation-export-follow-up-roadmap.md	docs/operations/post-generation-export-follow-up-roadmap.md	canonical	contributor	generation-export; roadmap; qemu	docs/INTEGRATION-TESTING.md; crates/conary-core/src/generation/export.rs; apps/conary/tests/integration/remi/manifests/phase3-group-o-generation-export.toml; docs/superpowers/limited-preview-release-checkpoint-2026-05-16.md; crates/conary-core/src/db/backup.rs	verified	corrected	Reframed around landed raw/qcow2, OCI source loading, boot activation, the May 21 installed-runtime export boot proof, ISO/provenance implementation, passing Group P ISO evidence, the landed protected live-root scriptlet sandbox /etc and /var private-layer work, and generation-bound SQLite DB backup recovery for published artifacts.
docs/operations/release-artifact-matrix.md	docs/operations/release-artifact-matrix.md	canonical	contributor	release-evidence; artifact-matrix; provenance; source-build; support-bundle	scripts/check-release-matrix.sh; scripts/release-matrix.sh; .github/workflows/release-build.yml; .github/workflows/deploy-and-verify.yml; docs/INTEGRATION-TESTING.md; scripts/conary-support-bundle.sh	verified	corrected	Added limited-preview artifact/source expectation matrix for conary, remi, conaryd, and conary-test with source-build-only caveats, checksum/signature/SBOM/provenance status, evidence commands, local QEMU evidence hygiene, and support-bundle privacy routing.
docs/specs/ccs-format-v1.md	docs/specs/ccs-format-v1.md	canonical	contributor	ccs-format; spec; scriptlet-capabilities	apps/conary/src/cli/ccs.rs; crates/conary-core/src/ccs/manifest.rs; crates/conary-core/src/ccs/archive_reader.rs; apps/conary/src/commands/ccs/install.rs	verified	corrected	Added the narrow `[[scriptlets.capabilities]]` manifest vocabulary for systemd, tmpfiles, and D-Bus registration paths, including parser validation and the fail-closed install-time enforcement boundary.
docs/superpowers/archive/2026-04-04-codebase-simplification-retrospective.md	docs/superpowers/archive/2026-04-04-codebase-simplification-retrospective.md	historical	historical	retrospective; archive	docs/superpowers/archive/2026-04-04-codebase-simplification-retrospective.md	verified	retained-historical	Retained as historical retrospective.
docs/superpowers/archive/2026-04-10-release-hardening-checklist.md	docs/superpowers/archive/2026-04-10-release-hardening-checklist.md	historical	historical	release-checklist; historical-framing	docs/operations/infrastructure.md; scripts/release.sh; scripts/release-matrix.sh	verified	archived	Archived the historical release-hardening execution record out of the active planning tree while preserving release-run evidence.
docs/superpowers/daily-driver-readiness-completion-audit-2026-05-22.md	docs/superpowers/daily-driver-readiness-completion-audit-2026-05-22.md	planning	maintainer	daily-driver-readiness; completion-audit; release-honesty; native-authority-handoff	docs/superpowers/specs/archive/2026-05-19-daily-driver-readiness-program-design.md; README.md; ROADMAP.md; docs/INTEGRATION-TESTING.md; scripts/local-qemu-validation.sh; apps/conary/tests/integration/remi/manifests/phase1-advanced.toml; apps/conary/tests/integration/remi/manifests/phase3-active-generation-handoff.toml; apps/conary/tests/integration/remi/manifests/phase4-native-pm-parity.toml	verified	corrected	Updated the evidence-first 2026-05-22 completion audit after the superseding Goal 1 branch: the original missing-suite blocker is preserved as historical context, and current status points to selected-generation native handoff proof across Fedora 44, Ubuntu 26.04 LTS, and Arch.
docs/superpowers/documentation-accuracy-audit-summary.md	docs/superpowers/documentation-accuracy-audit-summary.md	planning	maintainer	audit-summary; verification; release-hardening; active-planning; maintainability; feature-ownership; drift-control; live-mutation; install-hotspot; ccs-payload-paths; update-selection; update-adopted-authority; update-collection; update-module-completion; phase14; remi-conversion-service; phase15; ccs-install-completion; phase16; install-module-completion	docs/superpowers/documentation-accuracy-audit-ledger.tsv; docs/superpowers/documentation-accuracy-audit-inventory.tsv; scripts/check-doc-audit-ledger.sh; scripts/docs-audit-inventory.sh; scripts/line-count-report.sh; scripts/maintainability-drift-report.sh; ROADMAP.md; docs/superpowers/plans/2026-06-06-project-maintainability-agent-readiness-roadmap.md; docs/superpowers/plans/2026-06-06-project-maintainability-phase1-repo-discipline-contract-plan.md; docs/superpowers/plans/2026-06-06-project-maintainability-phase2-dead-surface-pruning-plan.md; docs/superpowers/plans/2026-06-06-project-maintainability-phase3-test-fixture-discipline-plan.md; docs/superpowers/plans/2026-06-06-project-maintainability-phase4-install-hotspot-decomposition-plan.md; docs/superpowers/plans/2026-06-06-project-maintainability-phase5-6-feature-ownership-workflow-plan.md; docs/superpowers/plans/2026-06-06-project-maintainability-phase7-enforcement-drift-control-plan.md; docs/superpowers/plans/2026-06-06-project-maintainability-phase8-install-ccs-transaction-decomposition-plan.md; docs/superpowers/plans/2026-06-06-project-maintainability-phase9-ccs-payload-paths-decomposition-plan.md; docs/superpowers/plans/2026-06-06-project-maintainability-phase10-update-selection-decomposition-plan.md; docs/superpowers/plans/2026-06-06-project-maintainability-phase11-update-adopted-authority-decomposition-plan.md; docs/superpowers/plans/2026-06-06-project-maintainability-phase12-update-collection-decomposition-plan.md; docs/superpowers/plans/2026-06-06-project-maintainability-phase13-update-module-completion-decomposition-plan.md; docs/superpowers/plans/2026-06-06-project-maintainability-phase14-remi-conversion-service-decomposition-plan.md; docs/superpowers/plans/2026-06-07-project-maintainability-phase15-ccs-install-completion-decomposition-plan.md; docs/superpowers/plans/2026-06-07-project-maintainability-phase16-install-module-completion-decomposition-plan.md; docs/superpowers/specs/2026-06-06-live-system-mutation-ux-redesign.md; docs/superpowers/plans/2026-06-06-live-system-mutation-ux-implementation-plan.md; apps/conary/src/commands/update/mod.rs; apps/conary/src/commands/update/collection.rs; apps/conary/src/commands/update/package.rs; apps/conary/src/commands/update/source_policy.rs; apps/conary/src/commands/update/pinning.rs; apps/conary/src/commands/update/delta_stats.rs; docs/modules/test-fixtures.md; docs/modules/feature-ownership.md; docs/llms/README.md; docs/llms/subsystem-map.md; docs/modules/source-selection.md; docs/modules/ccs.md; docs/modules/remi.md; CONTRIBUTING.md; .github/PULL_REQUEST_TEMPLATE.md; docs/superpowers/project-maintainability-dead-surface-inventory-2026-06-06.md	verified	corrected	Refreshed the audit summary for the active maintainability planning lane, current docs-audit counts, Phase 1 through Phase 15 maintainability packets, feature ownership workflow routing, warn-only maintainability drift reporting, live-system mutation UX redesign planning and implementation planning, the install CCS transaction decomposition plan, the CCS payload path decomposition plan, the update selection decomposition plan, the update adopted authority decomposition plan, the update collection decomposition implementation, the implemented update module completion decomposition, the Phase 14 Remi conversion service decomposition, and the Phase 15 CCS install completion decomposition, and the Phase 16 install module completion decomposition.
docs/superpowers/limited-preview-release-checkpoint-2026-05-16.md	docs/superpowers/limited-preview-release-checkpoint-2026-05-16.md	planning	maintainer	limited-preview-checkpoint; validation; security; public-preview; native-authority-handoff	README.md; ROADMAP.md; docs/INTEGRATION-TESTING.md; scripts/release-cargo-audit.sh; apps/conary/tests/integration/remi/manifests/phase1-advanced.toml; apps/conary/tests/integration/remi/manifests/phase3-group-n-qemu.toml; apps/conary/tests/integration/remi/manifests/phase3-group-o-generation-export.toml; apps/conary/tests/integration/remi/manifests/phase3-active-generation-handoff.toml	verified	corrected	Added the 2026-05-16 limited-preview release checkpoint with adoption/unadoption proof, native parity evidence, security triage, Group N refresh, resolved Group O TGE04 blocker, May 19 Group O pass, and public-trial recommendation; refreshed it after Goal 1 so selected-generation handoff is an explicit command path rather than an absent promise.
docs/superpowers/limited-preview-subreddit-tester-post-2026-05-19.md	docs/superpowers/limited-preview-subreddit-tester-post-2026-05-19.md	planning	maintainer	limited-preview; public-tester-copy; adoption-led-preview; native-authority-handoff	docs/superpowers/limited-preview-release-checkpoint-2026-05-16.md; README.md; ROADMAP.md; docs/INTEGRATION-TESTING.md	verified	corrected	Added the May 19 narrow public tester-post draft to the audited doc set; refreshed the caveats after Goal 1 so selected-generation hosts point at the explicit native handoff recovery flow instead of a missing follow-up.
docs/superpowers/plans/2026-06-05-ccs-native-ecosystem-roadmap.md	docs/superpowers/plans/2026-06-05-ccs-native-ecosystem-roadmap.md	planning	maintainer	ccs-native; roadmap; package-contract; maintainer-ergonomics; remi-publication; supported-distros; proof-corpus	AGENTS.md; docs/llms/README.md; docs/ARCHITECTURE.md; docs/modules/ccs.md; docs/modules/remi.md; docs/modules/recipe.md; docs/specs/ccs-format-v1.md; crates/conary-core/src/ccs/manifest.rs; crates/conary-core/src/ccs/binary_manifest.rs; crates/conary-core/src/ccs/package.rs; crates/conary-core/src/ccs/archive_reader.rs; apps/conary/src/commands/ccs; apps/remi/src/server; data/distros.toml	verified	corrected	Added the reviewed CCS-native ecosystem umbrella roadmap with phase gates for the v2 package contract, maintainer-friendly authoring/build workflow, Remi-native publication, supported Fedora 44/Ubuntu 26.04/Arch adapter profiles, and native proof corpus; keeps later implementation behind phase-specific design/plans and explicit docs-audit gates.
docs/superpowers/plans/2026-06-06-live-system-mutation-ux-implementation-plan.md	docs/superpowers/plans/2026-06-06-live-system-mutation-ux-implementation-plan.md	planning	maintainer	live-mutation; command-risk; contributor-ux; conaryd; implementation-plan	docs/superpowers/specs/2026-06-06-live-system-mutation-ux-redesign.md; apps/conary/src/command_risk.rs; apps/conary/src/live_host_safety.rs; apps/conary/src/cli/mod.rs; apps/conary/src/dispatch.rs; apps/conary/tests/live_host_mutation_safety.rs; apps/conary/tests/cli_daily_ux.rs; apps/conaryd/src/daemon/package_ops.rs; apps/conaryd/src/daemon/routes.rs; apps/conary-test/src/config/mod.rs; scripts/bootstrap-vm/guest-validate.sh; site/src/routes/install/+page.svelte; docs/operations/live-mutation-backup-inventory.md	verified	corrected	Added the reviewed implementation plan for the live-system mutation UX redesign: hidden compatibility for the old global flag, risk-tiered apply intent, conaryd request compatibility, expanded manifest validation, active script/site/docs migration, and refusal-before-mutation verification gates.
docs/superpowers/plans/2026-06-06-project-maintainability-agent-readiness-roadmap.md	docs/superpowers/plans/2026-06-06-project-maintainability-agent-readiness-roadmap.md	planning	maintainer	maintainability; contributor-ux; agent-readiness; umbrella-roadmap	AGENTS.md; docs/llms/README.md; docs/llms/subsystem-map.md; docs/ARCHITECTURE.md; docs/INTEGRATION-TESTING.md; scripts/line-count-report.sh; docs/superpowers/plans/2026-06-06-project-maintainability-phase1-repo-discipline-contract-plan.md	verified	corrected	Updated the hotspot refresh guidance to route child plans through scripts/line-count-report.sh 30, then seeded follow-up child designs for feature ownership and interaction gates, MIT-only license simplification, and live-system mutation acknowledgement UX.
docs/superpowers/plans/2026-06-06-project-maintainability-phase1-repo-discipline-contract-plan.md	docs/superpowers/plans/2026-06-06-project-maintainability-phase1-repo-discipline-contract-plan.md	planning	maintainer	maintainability; phase1; discipline-contract; line-count-report	AGENTS.md; docs/llms/README.md; CONTRIBUTING.md; .github/PULL_REQUEST_TEMPLATE.md; docs/superpowers/plans/2026-06-06-project-maintainability-agent-readiness-roadmap.md; scripts/docs-audit-inventory.sh; scripts/check-doc-audit-ledger.sh	verified	corrected	Added the reviewed Phase 1 implementation plan for compact maintainability discipline guidance, umbrella hotspot-refresh routing, and a lightweight Rust line-count report script.
docs/superpowers/plans/2026-06-06-project-maintainability-phase2-dead-surface-pruning-plan.md	docs/superpowers/plans/2026-06-06-project-maintainability-phase2-dead-surface-pruning-plan.md	planning	maintainer	maintainability; phase2; dead-surface-pruning; stale-surface-inventory	AGENTS.md; CONTRIBUTING.md; docs/llms/README.md; docs/llms/subsystem-map.md; docs/superpowers/plans/2026-06-06-project-maintainability-agent-readiness-roadmap.md; docs/superpowers/plans/2026-06-05-ccs-native-ecosystem-roadmap.md; data/distros.toml; apps/conary/src/cli/repo.rs; apps/conary/src/commands/ccs/init.rs; apps/remi/src/bin/remi.rs; scripts/docs-audit-inventory.sh; scripts/check-doc-audit-ledger.sh	verified	corrected	Added the reviewed Phase 2 implementation plan for the first dead-surface pruning slice: portable docs-audit inventory filtering, tested public CLI help cleanup, current supported-target wording, CCS init command-name correction, and a pruning inventory artifact.
docs/superpowers/plans/2026-06-06-project-maintainability-phase3-test-fixture-discipline-plan.md	docs/superpowers/plans/2026-06-06-project-maintainability-phase3-test-fixture-discipline-plan.md	planning	maintainer	maintainability; phase3; test-fixtures; fixture-discipline; remi; ccs	AGENTS.md; docs/llms/README.md; docs/llms/subsystem-map.md; docs/ARCHITECTURE.md; docs/INTEGRATION-TESTING.md; docs/modules/ccs.md; docs/modules/remi.md; docs/superpowers/plans/2026-06-06-project-maintainability-agent-readiness-roadmap.md; docs/superpowers/plans/2026-06-05-ccs-native-ecosystem-roadmap.md; crates/conary-core/src/ccs/convert/golden_fixtures.rs; crates/conary-core/src/ccs/convert/support_matrix.rs; apps/conary/tests/common/legacy_scriptlet_fixtures.rs; apps/remi/src/server/publication.rs; apps/remi/src/server/conversion.rs; apps/conary/tests/integration/remi/manifests	verified	corrected	Added the reviewed Phase 3 plan for the first test and fixture discipline slice: a Remi plus CCS conversion/publication fixture ownership map, exact proof recipes, and docs routing without moving fixtures.
docs/superpowers/plans/2026-06-06-project-maintainability-phase4-install-hotspot-decomposition-plan.md	docs/superpowers/plans/2026-06-06-project-maintainability-phase4-install-hotspot-decomposition-plan.md	planning	maintainer	maintainability; phase4; hotspot-decomposition; conary-install; legacy-replay	AGENTS.md; docs/llms/README.md; docs/llms/subsystem-map.md; docs/ARCHITECTURE.md; docs/INTEGRATION-TESTING.md; docs/modules/ccs.md; docs/modules/test-fixtures.md; docs/modules/source-selection.md; docs/superpowers/plans/2026-06-06-project-maintainability-agent-readiness-roadmap.md; docs/superpowers/plans/2026-06-05-ccs-native-ecosystem-roadmap.md; apps/conary/src/commands/install/mod.rs; apps/conary/src/commands/install/batch.rs; apps/conary/src/commands/install/restore.rs; apps/conary/src/commands/install/inner.rs; apps/conary/src/commands/update.rs; crates/conary-core/src/ccs/legacy_replay.rs	verified	corrected	Added the reviewed Phase 4 plan for the first install hotspot decomposition slice: extract the install-side legacy replay adapter, preserve import paths and replay gates, route docs to the new owner module, and avoid CCS native, Remi, conaryd, schema, and behavior changes.
docs/superpowers/plans/2026-06-06-project-maintainability-phase5-6-feature-ownership-workflow-plan.md	docs/superpowers/plans/2026-06-06-project-maintainability-phase5-6-feature-ownership-workflow-plan.md	planning	maintainer	maintainability; phase5; phase6; feature-ownership; contributor-ux; workflow	AGENTS.md; CONTRIBUTING.md; .github/PULL_REQUEST_TEMPLATE.md; docs/llms/README.md; docs/llms/subsystem-map.md; docs/ARCHITECTURE.md; docs/INTEGRATION-TESTING.md; docs/modules/ccs.md; docs/modules/remi.md; docs/modules/conaryd.md; docs/modules/source-selection.md; docs/modules/test-fixtures.md; docs/operations/bootstrap-selfhosting-vm.md; docs/operations/daily-driver-ux-matrix.md; docs/operations/post-generation-export-follow-up-roadmap.md; docs/superpowers/plans/2026-06-06-project-maintainability-agent-readiness-roadmap.md; docs/superpowers/plans/2026-06-05-ccs-native-ecosystem-roadmap.md	verified	corrected	Added the reviewed Phase 5/6 plan for feature ownership cards, contributor workflow routing, focused verification recipes, and cross-system interaction gates without changing Rust behavior, schemas, licensing, or live-mutation UX.
docs/superpowers/plans/2026-06-06-project-maintainability-phase7-enforcement-drift-control-plan.md	docs/superpowers/plans/2026-06-06-project-maintainability-phase7-enforcement-drift-control-plan.md	planning	maintainer	maintainability; phase7; drift-control; verification-hints; warn-only	scripts/line-count-report.sh; scripts/test-line-count-report.sh; scripts/docs-audit-inventory.sh; scripts/check-doc-audit-ledger.sh; docs/modules/feature-ownership.md; docs/llms/README.md; CONTRIBUTING.md; docs/superpowers/plans/2026-06-06-project-maintainability-agent-readiness-roadmap.md	verified	corrected	Added the reviewed Phase 7 plan for a warn-only maintainability drift report that maps changed paths to owner hints, focused proof commands, docs-audit health, and Rust hotspot context without adding a hard CI gate.
docs/superpowers/plans/2026-06-06-project-maintainability-phase8-install-ccs-transaction-decomposition-plan.md	docs/superpowers/plans/2026-06-06-project-maintainability-phase8-install-ccs-transaction-decomposition-plan.md	planning	maintainer	maintainability; phase8; install-hotspot; ccs-transaction; refactor-plan	apps/conary/src/commands/install/mod.rs; apps/conary/src/commands/install/legacy_replay.rs; apps/conary/src/commands/install/conversion.rs; apps/conary/src/commands/install/restore.rs; apps/conary/src/commands/ccs/install.rs; apps/conary/src/commands/update.rs; apps/conary/tests/bundle_replay.rs; apps/conary/tests/component.rs; scripts/line-count-report.sh; docs/superpowers/plans/2026-06-06-project-maintainability-agent-readiness-roadmap.md; docs/superpowers/plans/2026-06-06-project-maintainability-phase4-install-hotspot-decomposition-plan.md	verified	corrected	Added the reviewed Phase 8 plan for extracting direct CCS transaction install ownership from install/mod.rs into install/ccs_transaction.rs while preserving caller re-exports, live-root safety ordering, scriptlet capability gates, and CCS behavior.
docs/superpowers/plans/2026-06-06-project-maintainability-phase9-ccs-payload-paths-decomposition-plan.md	docs/superpowers/plans/2026-06-06-project-maintainability-phase9-ccs-payload-paths-decomposition-plan.md	planning	maintainer	maintainability; phase9; ccs; payload-paths; hotspot-decomposition	apps/conary/src/commands/ccs/install.rs; apps/conary/src/commands/ccs/runtime.rs; apps/conary/src/commands/install/ccs_transaction.rs; docs/modules/ccs.md	verified	corrected	Added Phase 9 plan for extracting CCS payload path normalization and symlink safety into a focused CCS module while preserving install and runtime behavior.
docs/superpowers/plans/2026-06-06-project-maintainability-phase10-update-selection-decomposition-plan.md	docs/superpowers/plans/2026-06-06-project-maintainability-phase10-update-selection-decomposition-plan.md	planning	maintainer	maintainability; phase10; update; selection; hotspot-decomposition	apps/conary/src/commands/update/mod.rs; apps/conary/src/commands/update/selection.rs; apps/conary/src/commands/mod.rs; apps/conary/tests/cli_daily_ux.rs; apps/conary/tests/native_pm_live_root.rs; docs/modules/source-selection.md; docs/modules/feature-ownership.md	verified	corrected	Added Phase 10 plan for extracting update candidate selection, source-switch previewing, and security-update eligibility into a focused update selection module while preserving update behavior.
docs/superpowers/plans/2026-06-06-project-maintainability-phase11-update-adopted-authority-decomposition-plan.md	docs/superpowers/plans/2026-06-06-project-maintainability-phase11-update-adopted-authority-decomposition-plan.md	planning	maintainer	maintainability; phase11; update; adopted-authority; hotspot-decomposition	apps/conary/src/commands/update/mod.rs; apps/conary/src/commands/update/selection.rs; apps/conary/src/commands/update/adopted_authority.rs; apps/conary/tests/cli_daily_ux.rs; docs/llms/subsystem-map.md; docs/modules/source-selection.md; docs/modules/feature-ownership.md	verified	corrected	Added Phase 11 plan for extracting adopted-package update authority policy, native package-manager fallback guidance, and adopted update skip text into a focused update submodule while preserving update behavior.
docs/superpowers/plans/2026-06-06-project-maintainability-phase12-update-collection-decomposition-plan.md	docs/superpowers/plans/2026-06-06-project-maintainability-phase12-update-collection-decomposition-plan.md	planning	maintainer	maintainability; phase12; update; collection-update; hotspot-decomposition	apps/conary/src/commands/update/mod.rs; apps/conary/src/commands/update/collection.rs; apps/conary/src/commands/update/selection.rs; apps/conary/src/commands/update/adopted_authority.rs; apps/conary/src/commands/mod.rs; apps/conary/src/dispatch.rs; apps/conary/tests/query.rs; docs/modules/source-selection.md; docs/modules/feature-ownership.md	verified	corrected	Added Phase 12 plan for extracting update collection target modeling and update @collection orchestration into a focused update submodule while preserving public command re-exports, adopted-authority handling, security metadata refusal, and per-member update behavior.
