origin_path	path	family	audience	claim_clusters	evidence_sources	status	disposition	notes
.github/ISSUE_TEMPLATE/bug_report.md	.github/ISSUE_TEMPLATE/bug_report.md	template	contributor	workflow-template; distro-baseline	AGENTS.md; data/distros.toml; apps/conary/tests/integration/remi/config.toml	verified	corrected	Updated example distro list to Fedora 44, Ubuntu 26.04 LTS, and Arch Linux.
.github/ISSUE_TEMPLATE/feature_request.md	.github/ISSUE_TEMPLATE/feature_request.md	template	contributor	workflow-template	.github/PULL_REQUEST_TEMPLATE.md; CONTRIBUTING.md	verified	verified-no-change	Generic feature-request template remains accurate.
.github/PULL_REQUEST_TEMPLATE.md	.github/PULL_REQUEST_TEMPLATE.md	template	contributor	workflow-template; verification	AGENTS.md; CONTRIBUTING.md; .github/workflows/pr-gate.yml	verified	verified-no-change	Template already matches current verification expectations.
.github/copilot-instructions.md	.github/copilot-instructions.md	template	contributor	assistant-guidance; canonical-routing	AGENTS.md; docs/llms/README.md	verified	verified-no-change	Thin tool-specific entrypoint still points to canonical assistant docs.
AGENTS.md	AGENTS.md	root	contributor	repo-contract; verification; assistant-guidance	docs/llms/README.md; docs/ARCHITECTURE.md; docs/INTEGRATION-TESTING.md; docs/operations/infrastructure.md	verified	verified-no-change	Canonical assistant contract remains map-like and accurate for the current workspace.
CHANGELOG.md	CHANGELOG.md	root	contributor	release-history; preview-readiness; conaryd-scope	scripts/release.sh; scripts/release-matrix.sh; docs/superpowers/archive/2026-04-10-release-hardening-checklist.md; scripts/release-cargo-audit.sh; docs/modules/conaryd.md	verified	corrected	Added an Unreleased preview-readiness section, recorded the temporary Forge validation pause plus local QEMU gate, and corrected the conaryd package-route status so it says daemon package jobs are queued instead of returning blanket 501 Not Implemented.
CONTRIBUTING.md	CONTRIBUTING.md	root	contributor	workspace-map; architecture; assistant-guidance	AGENTS.md; Cargo.toml; .github/copilot-instructions.md; GEMINI.md	verified	corrected	Updated generation/transaction wording and refreshed assistant-shim guidance after retiring the Claude entrypoint.
GEMINI.md	GEMINI.md	root	contributor	assistant-guidance; canonical-routing	AGENTS.md; docs/llms/README.md	verified	verified-no-change	Thin Gemini entrypoint remains accurate.
README.md	README.md	root	user	product-overview; adoption; generation-export; generation-publication; bootstrap; roadmap; conaryd-scope; daily-driver-ux	AGENTS.md; docs/ARCHITECTURE.md; docs/INTEGRATION-TESTING.md; docs/operations/post-generation-export-follow-up-roadmap.md; docs/operations/daily-driver-ux-matrix.md; docs/superpowers/limited-preview-release-checkpoint-2026-05-16.md; docs/superpowers/specs/2026-05-26-generation-publication-durability-design.md; apps/conary/src/commands/generation/commands.rs; apps/conary/src/commands/generation/publication.rs; data/distros.toml	verified	corrected	Refreshed user-facing status for the adoption-led Fedora 44, Ubuntu 26.04 LTS, and Arch package-manager preview matrix; non-destructive unadoption; explicit takeover; Conary-owned no-generation update behavior; security-update advisory support refusal; selected-generation native handoff dry-run/apply/recovery; conaryd package execution scope; the May 21 Group O generation-export pass; x86_64 ISO generation-carrier export with passing Group P evidence; typed whatprovides examples; the Goal 7 daily-driver UX matrix link; and Plan B pending generation publication debt inspection/retry commands.
ROADMAP.md	ROADMAP.md	root	user	roadmap; validation; adoption; generation-export; public-preview; daily-driver-ux; release-hardening	docs/INTEGRATION-TESTING.md; docs/operations/bootstrap-selfhosting-vm.md; docs/operations/post-generation-export-follow-up-roadmap.md; docs/operations/daily-driver-ux-matrix.md; docs/superpowers/limited-preview-release-checkpoint-2026-05-16.md; docs/superpowers/specs/2026-05-26-limited-preview-release-hardening-design.md; data/distros.toml	verified	corrected	Updated priorities and caveats around adoption-led preview, native package-manager authority, unadopt escape boundaries, explicit takeover, security-update honesty, selected-generation native handoff validation, local QEMU/security gates, the May 21 Group O generation-export boot proof, x86_64 ISO generation-carrier export, passing Group P ISO evidence, non-x86_64 generation boot assets, Goal 7 UX/completion checks, the 2026-05-26 review-derived release-hardening queue, Remi cold-start latency, adoption-lane rollback/post-success DB checkpoints, minimum Plan C first-tester supportability, and SQLite-native generation backup sequencing.
SECURITY.md	SECURITY.md	root	contributor	support-status; transaction-safety	CHANGELOG.md; Cargo.toml; data/distros.toml; crates/conary-core/src/generation/export.rs	verified	corrected	Updated supported version line to 0.8.x limited preview and added the Fedora 44, Ubuntu 26.04 LTS, and Arch support scope.
apps/conary-test/README.md	apps/conary-test/README.md	app-local	contributor	mcp; stateless-preview; bootstrap-status; suites-resource	apps/conary-test/src/server/stateless_mcp.rs; apps/conary-test/src/suite_inventory.rs; apps/conary-test/src/bootstrap.rs	verified	corrected	Updated stateless MCP route docs for bootstrap/status and conary-test://suites read-only resources.
apps/conary/tests/fixtures/adversarial/README.md	apps/conary/tests/fixtures/adversarial/README.md	app-local	contributor	test-fixtures; security-validation	apps/conary/tests/fixtures/adversarial/build-all.sh; apps/conary/tests/fixtures/adversarial/build-large.sh	verified	verified-no-change	Fixture guidance still matches the tracked adversarial fixture layout.
apps/conary/tests/scriptlet_harness/README.md	apps/conary/tests/scriptlet_harness/README.md	app-local	contributor	scriptlet-validation; security	crates/conary-core/src/scriptlet/mod.rs; apps/conary/tests/scriptlet_harness/test_scriptlets.py	verified	verified-no-change	Harness README remains accurate after the doc refresh.
bootstrap/stage0/README.md	bootstrap/stage0/README.md	app-local	contributor	bootstrap-history; legacy-toolchain	docs/modules/bootstrap.md; apps/conary/src/cli/bootstrap.rs; bootstrap/stage0/crosstool.config	verified	verified-no-change	Stage0 README remains clearly framed as historical crosstool-ng reference material.
deploy/CLOUDFLARE.md	deploy/CLOUDFLARE.md	deploy	operator	cloudflare; remi-admin; distro-baseline	deploy/remi.toml.example; docs/operations/infrastructure.md; apps/remi/src/server/routes/admin.rs	verified	corrected	Updated the Fedora index example and confirmed MCP/admin-origin proxying language.
deploy/FORGE.md	deploy/FORGE.md	deploy	operator	forge; conaryd-staging; validation	docs/operations/infrastructure.md; scripts/conaryd-health.sh; scripts/deploy-forge.sh; deploy/forge-rollouts.toml	verified	corrected	Marked the old Forge VPS retired, documented replacement-runner KVM checks, required explicit FORGE_HOST, and paused conaryd staging until a replacement host exists.
deploy/dracut/NOTE.md	deploy/dracut/NOTE.md	deploy	operator	boot-integration; deploy-note	packaging/dracut/90conary/module-setup.sh; deploy/dracut/mount-conary.sh	verified	verified-no-change	Deploy-time dracut note remains accurate.
deploy/remi.toml.example	deploy/remi.toml.example	deploy	operator	remi-config; distro-baseline; admin-origin	docs/operations/infrastructure.md; deploy/CLOUDFLARE.md; apps/remi/src/server/config.rs	verified	corrected	Updated Fedora and Ubuntu upstream release config, host-capacity wording, and external admin origin comments.
docs/ARCHITECTURE.md	docs/ARCHITECTURE.md	canonical	contributor	architecture; schema; generation-publication; generation-export; conaryd-scope	crates/conary-core/src/db/schema.rs; crates/conary-core/src/db/models/generation_publication.rs; crates/conary-core/src/generation/builder/runtime_inputs.rs; crates/conary-core/src/generation/export.rs; apps/conaryd/src/daemon/routes/transactions.rs	verified	corrected	Refreshed schema v69, runtime input validation, self-contained artifact export, rootful bootstrap handoff wording, and conaryd package-execution scope.
docs/INTEGRATION-TESTING.md	docs/INTEGRATION-TESTING.md	canonical	contributor	integration-testing; adoption; unadopt; qemu; fedora44; daily-driver-ux; native-authority-handoff	apps/conary/tests/integration/remi/manifests/phase1-advanced.toml; apps/conary/tests/integration/remi/manifests/phase3-group-n-qemu.toml; apps/conary/tests/integration/remi/manifests/phase3-group-o-generation-export.toml; apps/conary/tests/integration/remi/manifests/phase3-active-generation-handoff.toml; apps/conary/tests/integration/remi/manifests/phase4-native-pm-parity.toml; apps/conary/tests/fixtures/phase4-daily-driver-corpus/ccs.toml; apps/conary-test/src/config/manifest.rs; apps/conary-test/src/engine/qemu.rs; apps/conary/tests/native_pm_live_root.rs; apps/conary/tests/cli_daily_ux.rs	verified	corrected	Documented Phase 1 T21a-T21c non-destructive unadoption proof across Fedora 44, Ubuntu 26.04 LTS, and Arch, selected-generation native authority handoff proof across the same three distros, native live-root update/security refusal proof, refreshed Group N and Group O QEMU evidence, passing Group P ISO evidence, focused Slice C daily-driver/provider proof, Goal 7 CLI UX/completion proof, Slice D daily-driver corpus coverage/unsupported classes, 18-test result-gated evidence, and local validation notes.
docs/SCRIPTLET_SECURITY.md	docs/SCRIPTLET_SECURITY.md	canonical	contributor	scriptlet-security; verification; package-format-scope	crates/conary-core/src/scriptlet/mod.rs; crates/conary-core/src/container/mod.rs; apps/conary/src/cli/query.rs	verified	corrected	Clarified DEB-family scriptlet semantics without implying Debian is a public supported distro, then refreshed protected live-root sandbox semantics for private /etc and /var writable layers plus fail-closed namespace behavior.
docs/conaryopedia-v2.md	docs/conaryopedia-v2.md	canonical	contributor	handbook; schema; bootstrap; remi; generation-publication; generation-export; distro-scope; native-authority-handoff	crates/conary-core/src/db/schema.rs; crates/conary-core/src/db/models/generation_publication.rs; apps/conary/src/cli/bootstrap.rs; apps/conary/src/cli/generation.rs; apps/conary/src/commands/update.rs; apps/conary/src/commands/adopt/native_handoff.rs; apps/remi/src/server/routes/admin.rs; deploy/remi.toml.example	verified	corrected	Refreshed Fedora 44 and Ubuntu 26.04 examples, schema v69, LFS 13.0 bootstrap stages, generation export commands, Remi admin access, DEB parser support caveats, adopted-update authority, unadopt escape behavior, selected-generation native handoff guidance, security-advisory repository support, typed provider-query examples, and protected scriptlet namespace fallback wording.
docs/llms/README.md	docs/llms/README.md	canonical	contributor	assistant-guidance; doc-routing; gpt55	AGENTS.md; docs/ARCHITECTURE.md; docs/operations/post-generation-export-follow-up-roadmap.md; docs/operations/daily-driver-ux-matrix.md; scripts/docs-audit-inventory.sh	verified	corrected	Refreshed for GPT-5.5/Codex guidance, retired Claude active entrypoints, and current post-ISO/export follow-up routing.
docs/llms/archive/claude-era-notes.md	docs/llms/archive/claude-era-notes.md	historical	historical	assistant-history; archive	docs/llms/archive/claude-era-notes.md; docs/llms/README.md	verified	retained-historical	Retained as historical Claude-era guidance and updated to say tracked Claude active artifacts were removed.
docs/llms/subsystem-map.md	docs/llms/subsystem-map.md	canonical	contributor	assistant-guidance; subsystem-map	docs/ARCHITECTURE.md; crates/conary-core/src/generation/builder/runtime_inputs.rs; docs/operations/post-generation-export-follow-up-roadmap.md; apps/conary/src/commands/adopt/native_handoff.rs	verified	corrected	Refreshed subsystem pointers for selected-generation native handoff, adoption authority, and current post-ISO/export follow-up routing.
docs/modules/bootstrap.md	docs/modules/bootstrap.md	canonical	contributor	bootstrap; generation-export; self-hosting	apps/conary/src/cli/bootstrap.rs; crates/conary-core/src/bootstrap/mod.rs; crates/conary-core/src/generation/export.rs; docs/operations/bootstrap-selfhosting-vm.md; docs/INTEGRATION-TESTING.md	verified	corrected	Updated generation artifact export status and self-contained installed-runtime validation language, including the May 19 TGE04 installed-runtime export boot proof.
docs/modules/ccs.md	docs/modules/ccs.md	canonical	contributor	ccs; cli-surface	apps/conary/src/cli/ccs.rs; docs/specs/ccs-format-v1.md; crates/conary-core/src/ccs/manifest.rs	verified	verified-no-change	CCS module guide remains accurate.
docs/modules/conaryd.md	docs/modules/conaryd.md	canonical	contributor	conaryd; endpoint-reference; auth; preview-stubs	apps/conaryd/src/daemon/routes/system.rs; apps/conaryd/src/daemon/routes/transactions.rs; apps/conaryd/src/daemon/routes/query.rs; apps/conaryd/src/daemon/routes/events.rs; apps/conaryd/src/daemon/auth.rs; scripts/check-doc-truth.sh	verified	corrected	Added a maintained conaryd module reference with method-aware route inventory, v1 auth-boundary wording, preview-stubbed system route status, and fail-closed PolicyKit authorization wording checked by the docs truth gate.
docs/modules/federation.md	docs/modules/federation.md	canonical	contributor	federation; trust	apps/remi/src/federation/mod.rs; apps/conary/src/cli/federation.rs; docs/operations/infrastructure.md	verified	verified-no-change	Federation guide remains accurate for pinned HTTPS trust expectations.
docs/modules/query.md	docs/modules/query.md	canonical	contributor	query; cli-surface	apps/conary/src/cli/query.rs; apps/conary/src/dispatch.rs; apps/conary/src/commands/query	verified	verified-no-change	Query module guide remains accurate.
docs/modules/recipe.md	docs/modules/recipe.md	canonical	contributor	recipes; kitchen	crates/conary-core/src/recipe/format.rs; crates/conary-core/src/recipe/kitchen/cook.rs; recipes/versions.toml	verified	verified-no-change	Recipe module guide remains accurate.
docs/modules/source-selection.md	docs/modules/source-selection.md	canonical	contributor	source-selection; policy	crates/conary-core/src/repository/effective_policy.rs; apps/conary/src/commands/update.rs; apps/conary/src/commands/model.rs	verified	corrected	Updated update-flow notes for no-generation mutable live-root updates, adopted-package native authority, explicit takeover, and security-advisory support refusal.
docs/operations/LOCAL_ACCESS.example.md	docs/operations/LOCAL_ACCESS.example.md	template	contributor	local-access-template; secrets-policy	AGENTS.md; docs/operations/infrastructure.md	verified	verified-no-change	Local access template still directs sensitive host notes out of tracked docs.
docs/operations/agent-mcp-adapter-decision.md	docs/operations/agent-mcp-adapter-decision.md	canonical	contributor	mcp; stateless-adapter; bootstrap-status; suites-resource	crates/conary-mcp/src/stateless_http.rs; apps/conary-test/src/server/stateless_mcp.rs; apps/conary-test/src/suite_inventory.rs; docs/superpowers/specs/archive/2026-05-24-conary-test-suites-resource-design.md	verified	corrected	Updated adapter decision current state for conary-test bootstrap/status and suites resources while Remi remains unwired.
docs/operations/bootstrap-follow-up-investigations.md	docs/operations/bootstrap-follow-up-investigations.md	canonical	contributor	bootstrap-follow-up; generation-export	docs/operations/bootstrap-selfhosting-vm.md; docs/operations/post-generation-export-follow-up-roadmap.md; scripts/bootstrap-vm/build-selfhost-qcow2.sh	verified	corrected	Reframed after landed self-hosting and generation-export milestones.
docs/operations/bootstrap-selfhosting-vm.md	docs/operations/bootstrap-selfhosting-vm.md	canonical	contributor	self-hosting-vm; qemu; bootstrap	scripts/bootstrap-vm/build-selfhost-qcow2.sh; scripts/bootstrap-vm/validate-selfhost-vm.sh; recipes/versions.toml	verified	corrected	Updated rootful handoff, 32G qcow2 flow, Tier 2 audit, and validation caveats.
docs/operations/daily-driver-ux-matrix.md	docs/operations/daily-driver-ux-matrix.md	canonical	contributor	daily-driver-ux; cli-diagnostics; shell-completions	README.md; ROADMAP.md; docs/INTEGRATION-TESTING.md; apps/conary/tests/cli_daily_ux.rs; apps/conary/src/cli/mod.rs	verified	corrected	Added checked-in Goal 7 matrix for install/remove/update/search/list/autoremove/pin/unpin diagnostics, unsupported-case routes, live mutation/conaryd guidance, and bash/zsh completion checks.
docs/operations/infrastructure.md	docs/operations/infrastructure.md	canonical	contributor	mcp; operations; bootstrap-status; suites-resource	apps/conary-test/src/server/stateless_mcp.rs; apps/conary-test/src/suite_inventory.rs; docs/operations/agent-mcp-adapter-decision.md	verified	corrected	Updated agent operations guidance to record bootstrap/status and suites stateless preview resources.
docs/operations/post-generation-export-follow-up-roadmap.md	docs/operations/post-generation-export-follow-up-roadmap.md	canonical	contributor	generation-export; roadmap; qemu	docs/INTEGRATION-TESTING.md; crates/conary-core/src/generation/export.rs; apps/conary/tests/integration/remi/manifests/phase3-group-o-generation-export.toml; docs/superpowers/limited-preview-release-checkpoint-2026-05-16.md	verified	corrected	Reframed around landed raw/qcow2, OCI source loading, boot activation, the May 21 installed-runtime export boot proof, ISO/provenance implementation, passing Group P ISO evidence, and the landed protected live-root scriptlet sandbox /etc and /var private-layer work.
docs/specs/ccs-format-v1.md	docs/specs/ccs-format-v1.md	canonical	contributor	ccs-format; spec	apps/conary/src/cli/ccs.rs; crates/conary-core/src/ccs/manifest.rs	verified	verified-no-change	CCS format spec remains accurate.
docs/superpowers/archive/2026-04-04-codebase-simplification-retrospective.md	docs/superpowers/archive/2026-04-04-codebase-simplification-retrospective.md	historical	historical	retrospective; archive	docs/superpowers/archive/2026-04-04-codebase-simplification-retrospective.md	verified	retained-historical	Retained as historical retrospective.
docs/superpowers/archive/2026-04-10-release-hardening-checklist.md	docs/superpowers/archive/2026-04-10-release-hardening-checklist.md	historical	historical	release-checklist; historical-framing	docs/operations/infrastructure.md; scripts/release.sh; scripts/release-matrix.sh	verified	archived	Archived the historical release-hardening execution record out of the active planning tree while preserving release-run evidence.
docs/superpowers/daily-driver-readiness-completion-audit-2026-05-22.md	docs/superpowers/daily-driver-readiness-completion-audit-2026-05-22.md	planning	maintainer	daily-driver-readiness; completion-audit; release-honesty; native-authority-handoff	docs/superpowers/specs/archive/2026-05-19-daily-driver-readiness-program-design.md; README.md; ROADMAP.md; docs/INTEGRATION-TESTING.md; scripts/local-qemu-validation.sh; apps/conary/tests/integration/remi/manifests/phase1-advanced.toml; apps/conary/tests/integration/remi/manifests/phase3-active-generation-handoff.toml; apps/conary/tests/integration/remi/manifests/phase4-native-pm-parity.toml	verified	corrected	Updated the evidence-first 2026-05-22 completion audit after the superseding Goal 1 branch: the original missing-suite blocker is preserved as historical context, and current status points to selected-generation native handoff proof across Fedora 44, Ubuntu 26.04 LTS, and Arch.
docs/superpowers/documentation-accuracy-audit-summary.md	docs/superpowers/documentation-accuracy-audit-summary.md	planning	maintainer	audit-summary; verification; release-hardening; active-planning	docs/superpowers/documentation-accuracy-audit-ledger.tsv; docs/superpowers/documentation-accuracy-audit-inventory.tsv; scripts/check-doc-audit-ledger.sh; ROADMAP.md; docs/superpowers/specs/2026-05-26-limited-preview-release-hardening-design.md; docs/superpowers/plans/2026-05-26-preview-truth-and-onboarding.md; docs/superpowers/plans/2026-05-26-scriptlet-trust-assurance.md; docs/superpowers/plans/2026-05-26-release-evidence-and-supportability.md; docs/superpowers/plans/2026-05-26-generation-state-resilience.md	verified	corrected	Updated the audit summary for the 2026-05-26 review-derived release-hardening queue and the DeepSeek/Gemini/agentic follow-up tightening around Remi cold starts, live-mutation acknowledgement, system init, allowlist-only support bundles, namespace preflight diagnostics, first-tester supportability, bounded onboarding, source-selection scope, and SQLite-native DB backup resilience.
docs/superpowers/limited-preview-release-checkpoint-2026-05-16.md	docs/superpowers/limited-preview-release-checkpoint-2026-05-16.md	planning	maintainer	limited-preview-checkpoint; validation; security; public-preview; native-authority-handoff	README.md; ROADMAP.md; docs/INTEGRATION-TESTING.md; scripts/release-cargo-audit.sh; apps/conary/tests/integration/remi/manifests/phase1-advanced.toml; apps/conary/tests/integration/remi/manifests/phase3-group-n-qemu.toml; apps/conary/tests/integration/remi/manifests/phase3-group-o-generation-export.toml; apps/conary/tests/integration/remi/manifests/phase3-active-generation-handoff.toml	verified	corrected	Added the 2026-05-16 limited-preview release checkpoint with adoption/unadoption proof, native parity evidence, security triage, Group N refresh, resolved Group O TGE04 blocker, May 19 Group O pass, and public-trial recommendation; refreshed it after Goal 1 so selected-generation handoff is an explicit command path rather than an absent promise.
docs/superpowers/limited-preview-subreddit-tester-post-2026-05-19.md	docs/superpowers/limited-preview-subreddit-tester-post-2026-05-19.md	planning	maintainer	limited-preview; public-tester-copy; adoption-led-preview; native-authority-handoff	docs/superpowers/limited-preview-release-checkpoint-2026-05-16.md; README.md; ROADMAP.md; docs/INTEGRATION-TESTING.md	verified	corrected	Added the May 19 narrow public tester-post draft to the audited doc set; refreshed the caveats after Goal 1 so selected-generation hosts point at the explicit native handoff recovery flow instead of a missing follow-up.
docs/superpowers/plans/2026-05-26-generation-state-resilience.md	docs/superpowers/plans/2026-05-26-generation-state-resilience.md	planning	maintainer	generation-state; sqlite-recovery; sqlite-backup; implementation-plan	docs/superpowers/specs/2026-05-26-limited-preview-release-hardening-design.md; crates/conary-core/src/db; apps/conary/src/commands/generation; apps/conary/src/commands/adopt; docs/ARCHITECTURE.md; docs/conaryopedia-v2.md	verified	corrected	Revised active implementation plan away from custom JSON state mirrors toward live-mutation inventory, adoption-lane pre/post SQLite checkpoints, non-generation backup recovery, WAL-safe restore, generation-bound SQLite-native backups, manifest verification, and dry-run recovery from copied backups.
docs/superpowers/plans/2026-05-26-preview-truth-and-onboarding.md	docs/superpowers/plans/2026-05-26-preview-truth-and-onboarding.md	planning	maintainer	preview-truth; onboarding; docs-truth; adoption; implementation-plan	docs/superpowers/specs/2026-05-26-limited-preview-release-hardening-design.md; README.md; CHANGELOG.md; ROADMAP.md; scripts/check-doc-truth.sh; site/src/routes	verified	corrected	Added active implementation plan for public truth drift, bounded adoption onboarding, live-mutation acknowledgement explanation, Remi cold-start mitigation thresholds, system init first-run failure modes, Nix comparison, full-site docs-truth coverage, source-selection documentation, and single-package adoption dry-run routing.
docs/superpowers/plans/2026-05-26-release-evidence-and-supportability.md	docs/superpowers/plans/2026-05-26-release-evidence-and-supportability.md	planning	maintainer	release-evidence; artifact-matrix; supportability; beta-feedback; implementation-plan	docs/superpowers/specs/2026-05-26-limited-preview-release-hardening-design.md; scripts/check-release-matrix.sh; docs/INTEGRATION-TESTING.md; CONTRIBUTING.md; .github/ISSUE_TEMPLATE/bug_report.md	verified	corrected	Added active implementation plan for a minimum first-tester support slice, artifact/provenance/source-build matrix, allowlist-only support bundles with explicit DB exclusion and privacy tests, beta feedback intake, raw-log issue-template cleanup, concrete contributor onboarding entry points, binary URL expectations, and dated QEMU evidence hygiene.
docs/superpowers/plans/2026-05-26-scriptlet-trust-assurance.md	docs/superpowers/plans/2026-05-26-scriptlet-trust-assurance.md	planning	maintainer	scriptlet-security; sandbox-assurance; namespace-preflight; capability-declarations; implementation-plan	docs/superpowers/specs/2026-05-26-limited-preview-release-hardening-design.md; docs/SCRIPTLET_SECURITY.md; crates/conary-core/src/container/mod.rs; crates/conary-core/src/capability/declaration.rs; apps/conary/src/commands/install/scriptlets.rs	verified	corrected	Added active implementation plan for protected scriptlet sandbox assurance, pre-mutation sandbox setup checks, typed scriptlet outcomes, chroot/root-transition wording, seccomp truth verification, readable namespace preflight diagnostics for hardened kernels and containers, structured scriptlet degradation metadata, and capability-scoped integration hooks that fail closed until enforcement exists.
